"location","source","target","id","fuzzy","context","translator_comments","developer_comments"
"_work/Data/Scripts/content/Story/B/B_AssignAmbientInfos_Bau_2.d:17","ENDE","KONEC","","False","Info_Bau_2_EXIT.description","",""
"_work/Data/Scripts/content/Story/B/B_AssignAmbientInfos_Bau_2.d:40","Arbeitest du freiwillig auf den Reisfeldern?","Pracuješ na rýžových polích dobrovolně?","","False","Info_Bau_2_WichtigePersonen.description","",""
"_work/Data/Scripts/content/Story/B/B_AssignAmbientInfos_Bau_2.d:50","Arbeitest du freiwillig auf den Reisfeldern?","Pracuješ na rýžových polích dobrovolně?","","False","Info_Bau_2_WichtigePersonen_15_00","",""
"_work/Data/Scripts/content/Story/B/B_AssignAmbientInfos_Bau_2.d:51","Ja. Ja das tue ich. Ist nämlich besser freiwillig zu arbeiten, als von den Schlägern vom Reislord abgeholt zu werden.","Jo. Pracuju. Lepší tady pracovat ze své vlastní vůle, než abych k tomu byl nucen hrdlořezy Rýžového Lorda.","","False","Info_Bau_2_WichtigePersonen_02_01","",""
"_work/Data/Scripts/content/Story/B/B_AssignAmbientInfos_Bau_2.d:52","So so ...","Aha...","","False","Info_Bau_2_WichtigePersonen_15_02","",""
"_work/Data/Scripts/content/Story/B/B_AssignAmbientInfos_Bau_2.d:67","Was kannst du mir über das Lager erzählen?","Můžeš mi něco říct o táboře?","","False","Info_Bau_2_DasLager.description","",""
"_work/Data/Scripts/content/Story/B/B_AssignAmbientInfos_Bau_2.d:77","Was kannst du mir über das Lager erzählen?","Můžeš mi něco říci o táboře?","","False","Info_Bau_2_DasLager_15_00","",""
"_work/Data/Scripts/content/Story/B/B_AssignAmbientInfos_Bau_2.d:78","Es ist gefährlich, da hinzugehen. Lee's Söldner und die Magier sind ja ganz in Ordnung, aber auf die Banditen passt du besser auf!","Je nebezpečné tam chodit. Leeovi žoldáci a mágové jsou docela v pohodě, ale před bandity se musíš mít na pozoru!","","False","Info_Bau_2_DasLager_02_01","",""
"_work/Data/Scripts/content/Story/B/B_AssignAmbientInfos_Bau_2.d:95","Alles klar bei dir?","Jsi v pořádku?","","False","Info_Bau_2_DieLage.description","",""
"_work/Data/Scripts/content/Story/B/B_AssignAmbientInfos_Bau_2.d:105","Alles klar bei dir?","Jsi v pořádku?","","False","Info_Bau_2_DieLage_15_00","",""
"_work/Data/Scripts/content/Story/B/B_AssignAmbientInfos_Bau_2.d:106","Was willst du? Hat Der Reislord dich geschickt? Ich arbeite doch jeden Tag!","Co chceš? Poslal tě Rýžový Lord? Vždyť pracuju každý den!","","False","Info_Bau_2_DieLage_02_01","",""
"_work/Data/Scripts/content/Story/B/B_AssignAmbientInfos_Bau_2.d:107","Niemand hat mich geschickt - ich will mich nur ein bisschen unterhalten.","Nikdo mě neposlal, jen jsem si chtěl popovídat.","","False","Info_Bau_2_DieLage_15_02","",""
"_work/Data/Scripts/content/Story/B/B_AssignAmbientInfos_Bau_2.d:122","Lefty schickt mich. Ich hab Wasser für dich.","Lefty mě poslal. Přinesl jsem ti trochu vody.","","False","Info_Bau_2_Wasser.description","",""
"_work/Data/Scripts/content/Story/B/B_AssignAmbientInfos_Bau_2.d:136","Lefty schickt mich. Ich hab' Wasser für dich.","Lefty mě poslal. Přinesl jsem ti trochu vody.","","False","Info_Bau_2_Wasser_15_00","",""
"_work/Data/Scripts/content/Story/B/B_AssignAmbientInfos_Bau_2.d:139","Danke, Mann. Ich sterbe vor Durst.","Díky, chlape. Umírám žízní.","","False","Info_Bau_2_Wasser_02_01","",""
"_work/Data/Scripts/content/Story/B/B_AssignAmbientInfos_Bau_2.d:158","Wasser! Hey, Mann! Du hast nichts mehr! Haben wieder alle was gekriegt bis auf mich?","Voda! Poslyš, už ti žádná nezbyla! Neříkej mi, že všichni kromě mě dostali?","","True","Info_Bau_2_Wasser_NOWATER_02_00","",""
"_work/Data/Scripts/content/Story/B/B_AssignAmbientInfos_Bau_4.d:17","ENDE","KONEC","","False","Info_Bau_4_EXIT.description","",""
"_work/Data/Scripts/content/Story/B/B_AssignAmbientInfos_Bau_4.d:40","Habt ihr einen Anführer?","Máte nějakého vůdce?","","False","Info_Bau_4_WichtigePersonen.description","",""
"_work/Data/Scripts/content/Story/B/B_AssignAmbientInfos_Bau_4.d:50","Habt ihr einen Anführer?","Máte nějakého vůdce?","","False","Info_Bau_4_WichtigePersonen_15_00","",""
"_work/Data/Scripts/content/Story/B/B_AssignAmbientInfos_Bau_4.d:51","Der Reislord ist so was wie unser Anführer. Aber die meisten arbeiten nur aus Angst vor ihm und seinen Schlägern.","Rýžový Lord je něco jako náš vůdce. Ale většina z nás pro něj pracuje jen ze strachu z něho a z jeho hrdlořezů.","","True","Info_Bau_4_WichtigePersonen_04_01","",""
"_work/Data/Scripts/content/Story/B/B_AssignAmbientInfos_Bau_4.d:52","Bei mir sieht das anders aus. Ich hab' schon ein paar Jahre auf dem Buckel und keine Lust mehr, mich mit den Banditen im Lager rumzuschlagen ... Die Reisfelder sind genau das Richtige für mich.","Já ale ne. Už jsem tu nějakých pár let, protože jsem měl už dost výprasků od těch lotrů z tábora... rýžová pole jsou pro mě to pravé.","","True","Info_Bau_4_WichtigePersonen_04_02","",""
"_work/Data/Scripts/content/Story/B/B_AssignAmbientInfos_Bau_4.d:67","Was muß ich über diesen Ort wissen?","Je něco, co bych měl vědět o tomhle místě?","","True","Info_Bau_4_DasLager.description","",""
"_work/Data/Scripts/content/Story/B/B_AssignAmbientInfos_Bau_4.d:77","Was muss ich über diesen Ort wissen?","Je něco, co bych měl o tomhle místě vědět?","","True","Info_Bau_4_DasLager_15_00","",""
"_work/Data/Scripts/content/Story/B/B_AssignAmbientInfos_Bau_4.d:78","Sei vorsichtig, wenn du ins Lager gehst, Junge! Da laufen so einige Halsabschneider rum, die einem Neuen wie dir an die Kehle wollen.","Dávej si v táboře pozor, chlapče. Motá se tam spousta zabijáků, kteří se nemohou dočkat, až si podají nováčky, jako jsi ty.","","True","Info_Bau_4_DasLager_04_01","",""
"_work/Data/Scripts/content/Story/B/B_AssignAmbientInfos_Bau_4.d:91","Wie läuft's denn so?","Jak to jde?","","True","Info_Bau_4_DieLage.description","",""
"_work/Data/Scripts/content/Story/B/B_AssignAmbientInfos_Bau_4.d:101","Wie läuft's denn so?","Jak to jde?","","True","Info_Bau_4_DieLage_15_00","",""
"_work/Data/Scripts/content/Story/B/B_AssignAmbientInfos_Bau_4.d:102","Gibt 'ne Menge zu tun. Wir brauchen viel Reis, um die Leute hier alle ernähren zu können.","Je tu spousta práce. Musíme dodávat hromady rýže na obživu všech těch lidí.","","True","Info_Bau_4_DieLage_04_01","",""
"_work/Data/Scripts/content/Story/B/B_AssignAmbientInfos_Bau_4.d:115","Lefty schickt mich. Ich hab Wasser für dich.","Lefty mě poslal. Přinesl jsem ti trochu vody.","","True","Info_Bau_4_Wasser.description","",""
"_work/Data/Scripts/content/Story/B/B_AssignAmbientInfos_Bau_4.d:129","Lefty schickt mich. Ich hab' Wasser für dich.","Lefty mě poslal. Přinesl jsem ti trochu vody.","","True","Info_Bau_4_Wasser_15_00","",""
"_work/Data/Scripts/content/Story/B/B_AssignAmbientInfos_Bau_4.d:140","Danke, Junge! Das hab' ich gebraucht!","Díky, kamaráde. Už jsem to potřeboval!","","True","Info_Bau_4_Wasser_04_01","",""
"_work/Data/Scripts/content/Story/B/B_AssignAmbientInfos_Bau_4.d:151","Aber du hast nichts mehr. Ist schon gut, Junge. Ich werd mich an die andern halten.","Ale tobě už žádná nezůstala. Nezoufej, chlapče. Řeknu někomu jinému.","","True","Info_Bau_4_Wasser_NOWATER_04_00","",""
"_work/Data/Scripts/content/Story/B/B_AssignAmbientInfos_Bau_9.d:17","ENDE","KONEC","","True","Info_Bau_9_EXIT.description","",""
"_work/Data/Scripts/content/Story/B/B_AssignAmbientInfos_Bau_9.d:40","Wer kümmert sich darum, daß hier auf den Feldern alles glatt geht?","Kdo má na starosti dohled nad plněním plánu práce na těch polích?","","True","Info_Bau_9_WichtigePersonen.description","",""
"_work/Data/Scripts/content/Story/B/B_AssignAmbientInfos_Bau_9.d:50","Wer kümmert sich darum, dass hier auf den Feldern alles glatt geht?","Kdo má na starosti dohled nad plněním plánu práce na těch polích?","","True","Info_Bau_9_WichtigePersonen_15_00","",""
"_work/Data/Scripts/content/Story/B/B_AssignAmbientInfos_Bau_9.d:51","Na, wir alle! Der Reislord überwacht zwar alles, aber ich glaube, er sitzt den ganzen Tag in seinem Bunker und zählt die Säcke.","Každý! Rýžový Lord sice hlídá všechno, ale já mám dojem, že celé dny prosedí ve svém bunkru a počítá pytle.","","True","Info_Bau_9_WichtigePersonen_09_01","",""
"_work/Data/Scripts/content/Story/B/B_AssignAmbientInfos_Bau_9.d:52","Na, immerhin hat er zusammen mit Homer die ganze Anlage hier gebaut ...","On a Homer to všechno vymysleli.","","True","Info_Bau_9_WichtigePersonen_09_02","",""
"_work/Data/Scripts/content/Story/B/B_AssignAmbientInfos_Bau_9.d:67","Erzähl mir was über dieses Lager.","Povídej mi o táboře.","","True","Info_Bau_9_DasLager.description","",""
"_work/Data/Scripts/content/Story/B/B_AssignAmbientInfos_Bau_9.d:77","Erzähl mir was über dieses Lager.","Povídej mi o táboře.","","True","Info_Bau_9_DasLager_15_00","",""
"_work/Data/Scripts/content/Story/B/B_AssignAmbientInfos_Bau_9.d:78","Es ist randvoll mit Arschlöchern. Wenn's nach mir ginge, sollten die Söldner alle Banditen einfach aus dem Lager werfen.","Je až po střechu plný bastardů. Kdyby bylo po mém, nechal bych žoldáky, aby všechny ty lotry z tábora vyházeli.","","True","Info_Bau_9_DasLager_09_01","",""
"_work/Data/Scripts/content/Story/B/B_AssignAmbientInfos_Bau_9.d:79","Die tun gar nichts für uns. Machen nur Ärger.","Nedělají nic...jenom problémy.","","True","Info_Bau_9_DasLager_09_02","",""
"_work/Data/Scripts/content/Story/B/B_AssignAmbientInfos_Bau_9.d:92","Wie steht's?","Jak to jde?","","True","Info_Bau_9_DieLage.description","",""
"_work/Data/Scripts/content/Story/B/B_AssignAmbientInfos_Bau_9.d:102","Wie steht's?","Jak se máš?","","True","Info_Bau_9_DieLage_15_00","",""
"_work/Data/Scripts/content/Story/B/B_AssignAmbientInfos_Bau_9.d:103","Wir arbeiten uns den Arsch ab, damit hier alle was zu futtern kriegen!","Pracujeme do úmoru, abysme dostali něco k jídlu!","","True","Info_Bau_9_DieLage_09_01","",""
"_work/Data/Scripts/content/Story/B/B_AssignAmbientInfos_Bau_9.d:116","Lefty schickt mich. Ich hab Wasser für dich.","Lefty mě poslal. Přinesl jsem ti trochu vody.","","True","Info_Bau_9_Wasser.description","",""
"_work/Data/Scripts/content/Story/B/B_AssignAmbientInfos_Bau_9.d:130","Lefty schickt mich. Ich hab' Wasser für dich.","Lefty mě poslal. Přinesl jsem ti trochu vody.","","True","Info_Bau_9_Wasser_15_00","",""
"_work/Data/Scripts/content/Story/B/B_AssignAmbientInfos_Bau_9.d:141","Danke, Mann! Ich war schon kurz davor, den Schlamm zu saufen.","Díky, kamaráde! Ještě chvilku a zešílel bych žízní!","","True","Info_Bau_9_Wasser_09_01","",""
"_work/Data/Scripts/content/Story/B/B_AssignAmbientInfos_Bau_9.d:152","Du hast nichts mehr. Ich hol' mir von den anderen was.","Už nic nezbylo. Vezmu trochu od ostatních.","","True","Info_Bau_9_Wasser_NOWATER_09_00","",""
"_work/Data/Scripts/content/Story/B/B_AssignAmbientInfos_Grd_13.d:40","Ich will Gardist werden.","Chci se stát strážcem.","","True","Info_grd_13_EinerVonEuchWerden.description","",""
"_work/Data/Scripts/content/Story/B/B_AssignAmbientInfos_Grd_13.d:56","Ich will Gardist werden.","Chci se stát strážcem.","","True","Info_grd_13_EinerVonEuchWerden_15_00","",""
"_work/Data/Scripts/content/Story/B/B_AssignAmbientInfos_Grd_13.d:57","Da hast du aber noch einiges vor dir, Junge!","Pak před sebou budeš mít dlouhou cestu, chlapče.","","True","Info_grd_13_EinerVonEuchWerden_13_01","",""
"_work/Data/Scripts/content/Story/B/B_AssignAmbientInfos_Grd_13.d:70","Wer hat hier das Sagen?","Kdo to tady vede?","","True","Info_grd_13_WichtigePersonen.description","",""
"_work/Data/Scripts/content/Story/B/B_AssignAmbientInfos_Grd_13.d:80","Wer hat hier das Sagen?","Kdo to tady vede?","","True","Info_grd_13_WichtigePersonen_15_00","",""
"_work/Data/Scripts/content/Story/B/B_AssignAmbientInfos_Grd_13.d:81","Ich hab hier das Sagen. Und ich sage: Sei vorsichtig, was du sagst, Junge!","Já tu dohlížím. A říkám ti: měl bys dávat, hochu, pozor na to, co říkáš!","","True","Info_grd_13_WichtigePersonen_13_01","",""
"_work/Data/Scripts/content/Story/B/B_AssignAmbientInfos_Grd_13.d:94","Wie komme ich in die Burg?","Jak se dostanu na hrad?","","True","Info_grd_13_DasLager.description","",""
"_work/Data/Scripts/content/Story/B/B_AssignAmbientInfos_Grd_13.d:107","Wie komme ich in die Burg?","Jak se dostanu na hrad?","","True","Info_grd_13_DasLager_15_00","",""
"_work/Data/Scripts/content/Story/B/B_AssignAmbientInfos_Grd_13.d:108","Gar nicht. Nur Gomez' Leute kommen in die Burg.","Nedostaneš. Tam smí jen Gomezovi lidé.","","True","Info_grd_13_DasLager_13_01","",""
"_work/Data/Scripts/content/Story/B/B_AssignAmbientInfos_Grd_13.d:110","Verstehe.","Aha...","","True","Info_grd_13_DasLager_Verstehe","",""
"_work/Data/Scripts/content/Story/B/B_AssignAmbientInfos_Grd_13.d:111","Und wenn ich die Wachen besteche?","Co kdybych podplatil stráže?","","True","Info_grd_13_DasLager_WachenBestechen","",""
"_work/Data/Scripts/content/Story/B/B_AssignAmbientInfos_Grd_13.d:112","Und wenn ich mit Gomez sprechen will?","Jak bych si mohl promluvit s Gomezem?","","True","Info_grd_13_DasLager_GomezSprechen","",""
"_work/Data/Scripts/content/Story/B/B_AssignAmbientInfos_Grd_13.d:117","Verstehe.","Aha...","","True","Info_grd_13_DasLager_Verstehe_15_00","",""
"_work/Data/Scripts/content/Story/B/B_AssignAmbientInfos_Grd_13.d:123","Und wenn ich die Wachen besteche?","Co kdybych podplatil stráže?","","True","Info_grd_13_DasLager_WachenBestechen_15_00","",""
"_work/Data/Scripts/content/Story/B/B_AssignAmbientInfos_Grd_13.d:124","Ganz schön dreist, Kleiner. Schätze für die richtige Menge Erz könntest du sie überzeugen, mal wegzusehen.","Máš ale nervy, mladej. Jediné, jak bys je mohl přesvědčit, aby se na minutku dívali jinam, je přinést jim něco rudy.","","True","Info_grd_13_DasLager_WachenBestechen_13_01","",""
"_work/Data/Scripts/content/Story/B/B_AssignAmbientInfos_Grd_13.d:125","Aber wenn Gomez erfährt, dass sie einen Frischling einfach so in seine Burg gelassen haben, lässt er sie in den Kerker werfen.","Jak se ale Gomez dozví, že nechali takové čerstvé maso napochodovat do jeho zámku, uvrhne je do vězení.","","True","Info_grd_13_DasLager_WachenBestechen_13_02","",""
"_work/Data/Scripts/content/Story/B/B_AssignAmbientInfos_Grd_13.d:126","Das steigert natürlich den Preis.","Jistě, takovýhle risk je ale nutný.","","True","Info_grd_13_DasLager_WachenBestechen_13_03","",""
"_work/Data/Scripts/content/Story/B/B_AssignAmbientInfos_Grd_13.d:127","Aber selbst wenn du reinkommst, was würdest du drinnen machen? Alle Gebäude sind streng bewacht.","Ale i když se dostaneš dovnitř, co tam budeš dělat? Všechny budovy jsou přísně střežené.","","True","Info_grd_13_DasLager_WachenBestechen_13_04","",""
"_work/Data/Scripts/content/Story/B/B_AssignAmbientInfos_Grd_13.d:128","Ich war nur neugierig.","Byl jsem zvědavý, to je vše.","","True","Info_grd_13_DasLager_WachenBestechen_15_05","",""
"_work/Data/Scripts/content/Story/B/B_AssignAmbientInfos_Grd_13.d:133","Und wenn ich mit Gomez sprechen will?","Jak bych si mohl promluvit s Gomezem?","","True","Info_grd_13_DasLager_GomezSprechen_15_00","",""
"_work/Data/Scripts/content/Story/B/B_AssignAmbientInfos_Grd_13.d:134","Gomez hat kein Interesse an dahergelaufenen Neuen, die sich noch nicht bewährt haben.","Gomeze nezajímají nováčci, kteří neprokázali své schopnosti.","","True","Info_grd_13_DasLager_GomezSprechen_13_01","",""
"_work/Data/Scripts/content/Story/B/B_AssignAmbientInfos_Grd_13.d:135","Rede mit Thorus, wenn es dir ernst ist.","Jestli to myslíš vážně, promluv si s Thorusem.","","True","Info_grd_13_DasLager_GomezSprechen_13_02","",""
"_work/Data/Scripts/content/Story/B/B_AssignAmbientInfos_Grd_13.d:151","Wie läuft's?","Jak to jde?","","True","Info_grd_13_DieLage.description","",""
"_work/Data/Scripts/content/Story/B/B_AssignAmbientInfos_Grd_13.d:164","Wie läuft's?","Jak to jde?","","True","Info_grd_13_DieLage_15_00","",""
"_work/Data/Scripts/content/Story/B/B_AssignAmbientInfos_Grd_13.d:165","Ruhig. Ab und zu gibt's Scherereien mit dem Neuen Lager oder ein paar von den Sektenspinnern.","Je klid. Občas nějaký problém s Novým táborem nebo pár sektářskými blázny.","","True","Info_grd_13_DieLage_13_01","",""
"_work/Data/Scripts/content/Story/B/B_AssignAmbientInfos_Grd_13.d:166","Solange du noch neu bist, hast du kein Problem damit, aber wenn du dich erst mal für ein Lager entschieden hast, steckst du mittendrin - wie wir alle.","Pokud jsi nový, všechno je jedno. Jakmile se ale rozhodneš, ke kterému táboru se dáš, pak jsi v tom jako my všichni.","","True","Info_grd_13_DieLage_13_02","",""
"_work/Data/Scripts/content/Story/B/B_AssignAmbientInfos_Grd_6.d:40","Ich will Gardist werden.","Nepotřebujete jednoho dobrého chlapa?","","True","Info_Grd_6_EinerVonEuchWerden.description","",""
"_work/Data/Scripts/content/Story/B/B_AssignAmbientInfos_Grd_6.d:56","Könnt ihr noch einen guten Mann brauchen?","Nepotřebujete jednoho dobrého chlapa?","","True","Info_Grd_6_EinerVonEuchWerden_15_00","",""
"_work/Data/Scripts/content/Story/B/B_AssignAmbientInfos_Grd_6.d:57","Frischling, was? Wenn du ein Lager suchst, das dich aufnimmt, probier's doch bei den Sektenspinnern, die nehmen jeden.","Ty musíš být jedním z těch nových, co? Jestli se rozmýšlíš, ke kterému táboru se dát, zkus ty sektářské blázny, těm je fuk, koho zaměstnávají.","","True","Info_Grd_6_EinerVonEuchWerden_06_01","",""
"_work/Data/Scripts/content/Story/B/B_AssignAmbientInfos_Grd_6.d:58","Bei uns wird nicht jeder genommen, es sei denn, du willst in der alten Mine buddeln gehen!","Nikoho nebereme, ale ty bys mohl jít kopat do Starého dolu!","","True","Info_Grd_6_EinerVonEuchWerden_06_02","",""
"_work/Data/Scripts/content/Story/B/B_AssignAmbientInfos_Grd_6.d:71","Wer hat hier das Sagen?","Kdo to tady vede?","","True","Info_Grd_6_WichtigePersonen.description","",""
"_work/Data/Scripts/content/Story/B/B_AssignAmbientInfos_Grd_6.d:81","Wer hat hier das Sagen?","Kdo to tady vede?","","True","Info_Grd_6_WichtigePersonen_15_00","",""
"_work/Data/Scripts/content/Story/B/B_AssignAmbientInfos_Grd_6.d:82","Thorus kümmert sich drum das alles läuft. Er ist direkt von Gomez beauftragt.","Thorus je jedním z těch, kteří hlídají, aby se nic neztratilo. Je dvojka hned po Gomezovi.","","True","Info_Grd_6_WichtigePersonen_06_01","",""
"_work/Data/Scripts/content/Story/B/B_AssignAmbientInfos_Grd_6.d:97","Ich bin neu hier. Was läuft denn so?","Jsem tady nový.","","True","Info_Grd_6_DasLager.description","",""
"_work/Data/Scripts/content/Story/B/B_AssignAmbientInfos_Grd_6.d:111","Ich bin neu hier.","Jsem tady nový.","","True","Info_Grd_6_DasLager_15_00","",""
"_work/Data/Scripts/content/Story/B/B_AssignAmbientInfos_Grd_6.d:112","Sehe ich.","Tak uvidíme.","","True","Info_Grd_6_DasLager_06_01","",""
"_work/Data/Scripts/content/Story/B/B_AssignAmbientInfos_Grd_6.d:113","Was läuft denn so?","Jak to jde?","","True","Info_Grd_6_DasLager_15_02","",""
"_work/Data/Scripts/content/Story/B/B_AssignAmbientInfos_Grd_6.d:114","Wer hier Ärger macht bekommt was aufs Maul.","Jestli tu budeš dělat problémy, budeš potrestán.","","True","Info_Grd_6_DasLager_06_03","",""
"_work/Data/Scripts/content/Story/B/B_AssignAmbientInfos_Grd_6.d:116","Verstehe.","Aha...","","True","Info_Grd_6_DasLager_Verstehe","",""
"_work/Data/Scripts/content/Story/B/B_AssignAmbientInfos_Grd_6.d:117","Was verstehst du unter Ärger?","Čemu říkáš problémy?","","True","Info_Grd_6_DasLager_WasIstAerger","",""
"_work/Data/Scripts/content/Story/B/B_AssignAmbientInfos_Grd_6.d:122","Verstehe.","Já vím.","","True","Info_Grd_6_DasLager_Verstehe_15_00","",""
"_work/Data/Scripts/content/Story/B/B_AssignAmbientInfos_Grd_6.d:128","Was verstehst du unter Ärger?","Čemu říkáš problémy?","","True","Info_Grd_6_DasLager_WasIstAerger_15_00","",""
"_work/Data/Scripts/content/Story/B/B_AssignAmbientInfos_Grd_6.d:129","Die meisten Buddler bezahlen uns, damit wir sie beschützen.","Většina kopáčů nám platí za ochranu.","","True","Info_Grd_6_DasLager_WasIstAerger_06_01","",""
"_work/Data/Scripts/content/Story/B/B_AssignAmbientInfos_Grd_6.d:130","Wenn du dich mit einem von ihnen anlegst, lernst du uns kennen.","Pokud se někoho z nich dotkneš, vyřídíme si to s tebou.","","True","Info_Grd_6_DasLager_WasIstAerger_06_02","",""
"_work/Data/Scripts/content/Story/B/B_AssignAmbientInfos_Grd_6.d:131","Erwische ich dich beim rumstöbern in fremden Hütten ...","Jestli tě nachytám šmejdit kolem cizích chatrčí..","","True","Info_Grd_6_DasLager_WasIstAerger_06_03","",""
"_work/Data/Scripts/content/Story/B/B_AssignAmbientInfos_Grd_6.d:132","Schon gut, ich hab's verstanden.","Dobře, dobře. Dám si pozor.","","True","Info_Grd_6_DasLager_WasIstAerger_15_04","",""
"_work/Data/Scripts/content/Story/B/B_AssignAmbientInfos_Grd_6.d:146","Wie sieht's aus?","Jak to jde?","","True","Info_Grd_6_DieLage.description","",""
"_work/Data/Scripts/content/Story/B/B_AssignAmbientInfos_Grd_6.d:156","Wie sieht's aus?","Jak to jde?","","True","Info_Grd_6_DieLage_15_00","",""
"_work/Data/Scripts/content/Story/B/B_AssignAmbientInfos_Grd_6.d:157","Willst du Ärger machen?","Říkáš si o malér?","","True","Info_Grd_6_DieLage_06_01","",""
"_work/Data/Scripts/content/Story/B/B_AssignAmbientInfos_Grd_7.d:40","Was muß ich tun, um bei Gomez' Gardisten aufgenommen zu werden?","Co mám udělat proto, abych byl přijat mezi Gomezovy stráže?","","True","Info_grd_7_EinerVonEuchWerden.description","",""
"_work/Data/Scripts/content/Story/B/B_AssignAmbientInfos_Grd_7.d:56","Was muss ich tun, um bei Gomez' Gardisten aufgenommen zu werden?","Co mám udělat proto, abych byl přijat mezi Gomezovy stráže?","","True","Info_grd_7_EinerVonEuchWerden_15_00","",""
"_work/Data/Scripts/content/Story/B/B_AssignAmbientInfos_Grd_7.d:57","Du?! Du machst mir Spaß. Kommst hier rein und willst direkt ganz nach oben, was?","Ty?! Jsi blázen. Myslíš, že si sem přijdeš jen tak a budeš hned nahoře, nebo co?","","True","Info_grd_7_EinerVonEuchWerden_07_01","",""
"_work/Data/Scripts/content/Story/B/B_AssignAmbientInfos_Grd_7.d:58","Gomez macht nur die Besten seiner Leute zu Gardisten.","Gomez má mezi stráží jen ty nejlepší.","","True","Info_grd_7_EinerVonEuchWerden_07_02","",""
"_work/Data/Scripts/content/Story/B/B_AssignAmbientInfos_Grd_7.d:59","Du wirst wie alle anderen anfangen müssen, und deine Loyalität als Schatten unter Beweis stellen.","Musíš tu pracovat jako každý jiný a prokázat svou oddanost jako Stín.","","True","Info_grd_7_EinerVonEuchWerden_07_03","",""
"_work/Data/Scripts/content/Story/B/B_AssignAmbientInfos_Grd_7.d:72","Wer hat hier das Sagen?","Kdo to tady vede?","","True","Info_grd_7_WichtigePersonen.description","",""
"_work/Data/Scripts/content/Story/B/B_AssignAmbientInfos_Grd_7.d:84","Wer hat hier das Sagen?","Kdo to tady vede?","","True","Info_grd_7_WichtigePersonen_15_00","",""
"_work/Data/Scripts/content/Story/B/B_AssignAmbientInfos_Grd_7.d:85","Thorus kontrolliert alles, was im Lager läuft. Diego ist seine rechte Hand.","Thorus kontroluje všechno, co se děje v táboře. Diego je jeho pravá ruka.","","True","Info_grd_7_WichtigePersonen_07_01","",""
"_work/Data/Scripts/content/Story/B/B_AssignAmbientInfos_Grd_7.d:86","Wenn du hier aufgenommen werden willst, sind das die Leute, mit denen du reden musst.","Pokud chceš kamkoliv jít, musíš to těm hochům říci.","","True","Info_grd_7_WichtigePersonen_07_02","",""
"_work/Data/Scripts/content/Story/B/B_AssignAmbientInfos_Grd_7.d:103","Arbeiten alle Leute hier für die Erzbarone?","Pracují tady všichni pro Gomeze?","","True","Info_grd_7_DasLager.description","",""
"_work/Data/Scripts/content/Story/B/B_AssignAmbientInfos_Grd_7.d:115","Arbeiten alle Leute hier für Gomez?","Pracují tady všichni pro Gomeze?","","True","Info_grd_7_DasLager_15_00","",""
"_work/Data/Scripts/content/Story/B/B_AssignAmbientInfos_Grd_7.d:116","Nein. Die meisten hier sind einfache Buddler.","Ne. Většinou jsou to obyčejní kopáči.","","True","Info_grd_7_DasLager_07_01","",""
"_work/Data/Scripts/content/Story/B/B_AssignAmbientInfos_Grd_7.d:117","Nur wir Gardisten und die Schatten sind Gomez' Leute.","Jenom my, stráže a Stínové jsou s Gomezem.","","True","Info_grd_7_DasLager_07_02","",""
"_work/Data/Scripts/content/Story/B/B_AssignAmbientInfos_Grd_7.d:119","ZURÜCK","ZPĚT","","True","Info_grd_7_DasLager_Zurueck","",""
"_work/Data/Scripts/content/Story/B/B_AssignAmbientInfos_Grd_7.d:120","Was tun die Gardisten?","Co stráže dělají?","","True","Info_grd_7_DasLager_Gardisten","",""
"_work/Data/Scripts/content/Story/B/B_AssignAmbientInfos_Grd_7.d:121","Was ist die Aufgabe der Schatten?","Co dělají Stínové?","","True","Info_grd_7_DasLager_Schatten","",""
"_work/Data/Scripts/content/Story/B/B_AssignAmbientInfos_Grd_7.d:122","Wofür sind die Buddler da?","Co dělají kopáči?","","True","Info_grd_7_DasLager_Buddler","",""
"_work/Data/Scripts/content/Story/B/B_AssignAmbientInfos_Grd_7.d:132","Was tun die Gardisten?","Co stráže dělají?","","True","Info_grd_7_DasLager_WasIstAerger_15_00","",""
"_work/Data/Scripts/content/Story/B/B_AssignAmbientInfos_Grd_7.d:133","Wir bewachen das Lager und beschützen die Buddler.","Střežíme tábor a chráníme kopáče.","","True","Info_grd_7_DasLager_WasIstAerger_07_01","",""
