"location","source","target","id","fuzzy","context","translator_comments","developer_comments"
"_work/Data/Scripts/content/Story/EVENTS/Sleepabit.d:19","Du hast geschlafen und bist ausgeruht!","Spal jsi dobře a cítíš se lépe","","True","","","PrintScreen call."
"_work/Data/Scripts/content/Story/EVENTS/Sleepabit.d:83","Bis zum nächsten Morgen schlafen","Spi až do rána","","True","PC_SleepTime_Morning.description","",""
"_work/Data/Scripts/content/Story/EVENTS/Sleepabit.d:105","Bis Mittags schlafen","Spi až do odpoledne","","True","PC_SleepTime_Noon.description","",""
"_work/Data/Scripts/content/Story/EVENTS/Sleepabit.d:127","Bis zum nächsten Abend schlafen","Spi až do večera","","True","PC_SleepTime_Evening.description","",""
"_work/Data/Scripts/content/Story/EVENTS/Sleepabit.d:149","Bis Mitternacht schlafen","Spi až do půlnoci","","True","PC_SleepTime_Midnight.description","",""
