"location","source","target","id","fuzzy","context","translator_comments","developer_comments"
"_work/Data/Scripts/content/Story/MISSIONS/DIA_Grd_213_GuardPassage.d:201","Du könntest mal ein bisschen Abwechslung in dein Leben bringen. Lass doch mal jemanden in die Burg.","Víš, měl bys do života vnést trochu víc vzrušení. Jako třeba vpustit někoho na hrad.","","True","Info_Grd_213_Abblitzen_15_00","",""
"_work/Data/Scripts/content/Story/MISSIONS/DIA_Grd_213_GuardPassage.d:202","Abwechslung? Ist schon 'ne gute Idee - einen wie dich hab' ich schon lange nicht mehr verprügelt.","Vzrušení? To není špatný nápad - už dlouho jsem nevyrazil někoho, jako jsi ty!","","True","Info_Grd_213_Abblitzen_07_01","",""
"_work/Data/Scripts/content/Story/MISSIONS/DIA_Grd_213_GuardPassage.d:217","Na, alles klar?","Jsi v pořádku?","","True","Info_Grd_213_Passgate.description","",""
"_work/Data/Scripts/content/Story/MISSIONS/DIA_Grd_213_GuardPassage.d:230","Na, alles klar?","Hej, jsi v pořádku?","","True","Info_Grd_213_Passgate_15_00","",""
"_work/Data/Scripts/content/Story/MISSIONS/DIA_Grd_213_GuardPassage.d:231","Lunger hier nicht rum - geh rein.","Moc se tady nemotej - běž dovnitř.","","True","Info_Grd_213_Passgate_07_01","",""
"_work/Data/Scripts/content/Story/MISSIONS/DIA_Grd_214_Torwache.d:36","Was machst du hier?","Co takhle děláš celý den?","","True","DIA_Grd_214_Torwache_job.description","",""
"_work/Data/Scripts/content/Story/MISSIONS/DIA_Grd_214_Torwache.d:46","Was machst du hier?","Co takhle děláš celý den?","","True","DIA_Grd_214_Torwache_job_15_00","",""
"_work/Data/Scripts/content/Story/MISSIONS/DIA_Grd_214_Torwache.d:47","Ich passe auf, dass hier keiner reinkommt, der von Gomez nicht erwünscht ist.","Dávám pozor, aby se dovnitř nedostal nikdo, koho tam Gomez nechce.","","True","DIA_Grd_214_Torwache_job_07_01","",""
"_work/Data/Scripts/content/Story/MISSIONS/DIA_Grd_214_Torwache.d:48","Also mach keinen Ärger, wenn du drin bist, sonst bist du das letzte Mal hier gewesen.","Když budeš uvnitř, nedělej problémy, nebo se nikam nedostaneš.","","True","DIA_Grd_214_Torwache_job_07_02","",""
"_work/Data/Scripts/content/Story/MISSIONS/DIA_Grd_214_Torwache.d:75","Hey, gut dass du da bist. Thorus will dich sprechen!","Jsem rád, že tady jsi. Thorus tě chce vidět!","","True","Grd_214_Torwache_SEETHORUS_Info_07_01","",""
"_work/Data/Scripts/content/Story/MISSIONS/DIA_Grd_214_Torwache.d:76","Was will er denn?","Co chce?","","True","Grd_214_Torwache_SEETHORUS_Info_15_02","",""
"_work/Data/Scripts/content/Story/MISSIONS/DIA_Grd_214_Torwache.d:77","Das wird er dir schon selber sagen.","Určitě ti to brzy řekne.","","True","Grd_214_Torwache_SEETHORUS_Info_07_03","",""
"_work/Data/Scripts/content/Story/MISSIONS/DIA_Grd_214_Torwache.d:103","HEY DU!!! Versuchst wohl Dusty hier herauszuschmuggeln, was? ","HEJ, TY!!! Nepokoušíš se odtud propašovat rudný prach, že ne?","","True","Grd_214_Torwache_NODUSTY_Info_07_01","",""
"_work/Data/Scripts/content/Story/MISSIONS/DIA_Grd_214_Torwache.d:104","Wir wollen doch nur...","Chceme přece jen...","","True","Grd_214_Torwache_NODUSTY_Info_15_02","",""
"_work/Data/Scripts/content/Story/MISSIONS/DIA_Grd_214_Torwache.d:105","Du willst gleich gar nichts mehr!","Zanedlouho nebudete už chtít nic!","","True","Grd_214_Torwache_NODUSTY_Info_07_03","",""
"_work/Data/Scripts/content/Story/MISSIONS/DIA_Grd_215_Torwache.d:50","Wo soll's denn hingehen?","Kam máš namířeno?","","True","DIA_Grd_215_Torwache_First_06_00","",""
"_work/Data/Scripts/content/Story/MISSIONS/DIA_Grd_215_Torwache.d:51","Ich will ins Lager.","Do tábora.","","True","DIA_Grd_215_Torwache_First_15_01","",""
"_work/Data/Scripts/content/Story/MISSIONS/DIA_Grd_215_Torwache.d:52","Du bist doch nicht hergekommen, um Ärger zu machen, oder?","Nechceš se dostat do problémů, viď?","","True","DIA_Grd_215_Torwache_First_06_02","",""
"_work/Data/Scripts/content/Story/MISSIONS/DIA_Grd_215_Torwache.d:55","Klar, ich hatte mir vorgenommen, das ganze Lager auseinanderzunehmen!","Jistě, mám v úmyslu zabrat celý tábor.","","True","DIA_Grd_215_Torwache_First_Trouble","",""
"_work/Data/Scripts/content/Story/MISSIONS/DIA_Grd_215_Torwache.d:56","Ich will mich nur ein bißchen umsehen.","Chci se tu jenom porozhlédnout.","","True","DIA_Grd_215_Torwache_First_JustLooking","",""
"_work/Data/Scripts/content/Story/MISSIONS/DIA_Grd_215_Torwache.d:59","Diego hat gesagt, ich soll ihn im Lager treffen.","Diego řekl, že ho mám v táboře navštívit.","","True","DIA_Grd_215_Torwache_First_Diego","",""
"_work/Data/Scripts/content/Story/MISSIONS/DIA_Grd_215_Torwache.d:65","Klar, ich hatte mir vorgenommen, das ganze Lager auseinander zu nehmen!","Jistě, mám v úmyslu zabrat celý tábor.","","True","DIA_Grd_215_Torwache_First_Trouble_15_00","",""
"_work/Data/Scripts/content/Story/MISSIONS/DIA_Grd_215_Torwache.d:66","Ein witziger Kerl ... Ich mag keine witzigen Kerle.","No, to je pěknej šprýmař... A já nemám šprýmaře rád .","","True","DIA_Grd_215_Torwache_First_Trouble_06_01","",""
"_work/Data/Scripts/content/Story/MISSIONS/DIA_Grd_215_Torwache.d:76","Ich will mich nur ein bisschen umsehen.","Chci se tu jenom porozhlédnout.","","True","DIA_Grd_215_Torwache_First_JustLooking_15_00","",""
"_work/Data/Scripts/content/Story/MISSIONS/DIA_Grd_215_Torwache.d:77","Umsehen kostet 10 Erz.","To tě bude stát 10 nugetů.","","True","DIA_Grd_215_Torwache_First_JustLooking_06_01","",""
"_work/Data/Scripts/content/Story/MISSIONS/DIA_Grd_215_Torwache.d:80","Vergiß es.","Na to zapomeň.","","True","DIA_Grd_215_Torwache_First_NoPay","",""
"_work/Data/Scripts/content/Story/MISSIONS/DIA_Grd_215_Torwache.d:81","Gut, hier sind deine 10 Erz.","Dobrá, tady je tvých 10 nugetů.","","True","DIA_Grd_215_Torwache_First_Pay","",""
"_work/Data/Scripts/content/Story/MISSIONS/DIA_Grd_215_Torwache.d:86","Diego hat gesagt, ich soll ihn im Lager treffen.","Diego řekl, že ho mám v táboře navštívit.","","True","DIA_Grd_215_Torwache_First_Diego_15_00","",""
"_work/Data/Scripts/content/Story/MISSIONS/DIA_Grd_215_Torwache.d:87","Gut - du kannst reingehen.","Dobrá, pak tedy pojď dál.","","True","DIA_Grd_215_Torwache_First_Diego_06_01","",""
"_work/Data/Scripts/content/Story/MISSIONS/DIA_Grd_215_Torwache.d:93","Vergiss es.","Na to zapomeň.","","True","DIA_Grd_215_Torwache_First_NoPay_15_00","",""
"_work/Data/Scripts/content/Story/MISSIONS/DIA_Grd_215_Torwache.d:94","Dann zisch ab.","Pak vypadni.","","True","DIA_Grd_215_Torwache_First_NoPay_06_01","",""
"_work/Data/Scripts/content/Story/MISSIONS/DIA_Grd_215_Torwache.d:102","Gut, hier sind deine 10 Erz.","Dobrá, tady je tvých 10 nugetů.","","True","DIA_Grd_215_Torwache_First_Pay_15_00","",""
"_work/Data/Scripts/content/Story/MISSIONS/DIA_Grd_215_Torwache.d:103","Dann mal immer rein mit dir.","Pak pojď dál.","","True","DIA_Grd_215_Torwache_First_Pay_06_01","",""
"_work/Data/Scripts/content/Story/MISSIONS/DIA_Grd_215_Torwache.d:108","So viel hab' ich nicht.","Tolik u sebe nemám.","","True","DIA_Grd_215_Torwache_First_Pay_NoOre_15_00","",""
"_work/Data/Scripts/content/Story/MISSIONS/DIA_Grd_215_Torwache.d:109","Diesmal mach' ich noch 'ne Ausnahme - weil du neu bist .","Pro tentokrát udělám výjimku, protože jsi tu nový.","","True","DIA_Grd_215_Torwache_First_Pay_NoOre_06_01","",""
"_work/Data/Scripts/content/Story/MISSIONS/DIA_Grd_215_Torwache.d:128","Irgendwas Neues passiert?","Něco nového?","","True","DIA_Grd_215_Torwache_PERM.description","",""
"_work/Data/Scripts/content/Story/MISSIONS/DIA_Grd_215_Torwache.d:138","Irgendwas Neues passiert?","Něco nového?","","True","DIA_Grd_215_Torwache_PERM_15_00","",""
"_work/Data/Scripts/content/Story/MISSIONS/DIA_Grd_215_Torwache.d:139","Nein. Alles wie immer.","Ne. Všechno při starém.","","True","DIA_Grd_215_Torwache_PERM_06_01","",""
"_work/Data/Scripts/content/Story/MISSIONS/DIA_Grd_218_GuardPassage.d:49","Halt! Was willst du hier?","Stůj! Co tady děláš?","","True","DIA_Grd_218_FirstIn_07_00","",""
"_work/Data/Scripts/content/Story/MISSIONS/DIA_Grd_218_GuardPassage.d:50","Ich will hier rein.","Chci dovnitř.","","True","DIA_Grd_218_FirstIn_15_01","",""
"_work/Data/Scripts/content/Story/MISSIONS/DIA_Grd_218_GuardPassage.d:51","Machst du Witze?","To má být žert?","","True","DIA_Grd_218_FirstIn_07_02","",""
"_work/Data/Scripts/content/Story/MISSIONS/DIA_Grd_218_GuardPassage.d:52","Frag das doch mal Thorus.","Proč se nezeptáš Thoruse?","","True","DIA_Grd_218_FirstIn_15_03","",""
"_work/Data/Scripts/content/Story/MISSIONS/DIA_Grd_218_GuardPassage.d:53","Werde ich. Wenn du gelogen hast, bist du tot!","Udělám to. Jestli lžeš, jsi mrtvej!","","True","DIA_Grd_218_FirstIn_07_04","",""
"_work/Data/Scripts/content/Story/MISSIONS/DIA_Grd_218_GuardPassage.d:54","Soll das heißen, ich kann jetzt reingehen.","Říkáš, že můžu dál?","","True","DIA_Grd_218_FirstIn_15_05","",""
"_work/Data/Scripts/content/Story/MISSIONS/DIA_Grd_218_GuardPassage.d:55","Ja. Geh schon!","Jo, pohni sebou!","","True","DIA_Grd_218_FirstIn_07_06","",""
"_work/Data/Scripts/content/Story/MISSIONS/DIA_Grd_218_GuardPassage.d:75","OCC_BARONS_HALLWAY_FRONT","OCC_BARONS_HALLWAY_FRONT","","True","Grd_218_CHECKPOINT","",""
"_work/Data/Scripts/content/Story/MISSIONS/DIA_Grd_218_GuardPassage.d:105","HALT! Keinen Schritt weiter!","STŮJ! Už ani krok!","","True","Info_Grd_218_FirstWarn_Info_07_01","",""
"_work/Data/Scripts/content/Story/MISSIONS/DIA_Grd_218_GuardPassage.d:106","Warum?","Proč?","","True","Info_Grd_218_FirstWarn_Info_15_02","",""
"_work/Data/Scripts/content/Story/MISSIONS/DIA_Grd_218_GuardPassage.d:107","Das Haus der Erzbarone ist tabu für Abschaum wie dich!","Rudobaronův dům je tabu pro takové pobudy jako ty!","","True","Info_Grd_218_FirstWarn_Info_07_03","",""
"_work/Data/Scripts/content/Story/MISSIONS/DIA_Grd_224_Pacho.d:52","Hey, du!","Hej, ty!","","True","Info_Pacho_STOP_13_01","",""
"_work/Data/Scripts/content/Story/MISSIONS/DIA_Grd_224_Pacho.d:53","Wer? Ich?","Kdo? Já?","","True","Info_Pacho_STOP_15_02","",""
"_work/Data/Scripts/content/Story/MISSIONS/DIA_Grd_224_Pacho.d:54","Nein, ich mein deine Großmutter ... Natürlich mein ich dich!","Ne, tvoje bába... Kdo jiný asi?!","","True","Info_Pacho_STOP_13_03","",""
"_work/Data/Scripts/content/Story/MISSIONS/DIA_Grd_224_Pacho.d:55","Wenn ich du wäre, dann würde ich diesen Weg hier nicht weitergehen!","Být tebou, tak bych tudy nechodil!","","True","Info_Pacho_STOP_13_04","",""
"_work/Data/Scripts/content/Story/MISSIONS/DIA_Grd_224_Pacho.d:56","Warum nicht?","Proč ne?","","True","Info_Pacho_STOP_15_05","",""
"_work/Data/Scripts/content/Story/MISSIONS/DIA_Grd_224_Pacho.d:57","Du scheinst wirklich neu hier zu sein!","Ty tady asi nejsi ještě dlouho!","","True","Info_Pacho_STOP_13_06","",""
"_work/Data/Scripts/content/Story/MISSIONS/DIA_Grd_224_Pacho.d:58","Mann, hier geht es ins Orkgebiet!","Člověče, to je cesta do země skřetů...","","True","Info_Pacho_STOP_13_07","",""
"_work/Data/Scripts/content/Story/MISSIONS/DIA_Grd_224_Pacho.d:59","Die machen Kleinholz aus dir!","Udělají z tebe sekanou!","","True","Info_Pacho_STOP_13_08","",""
"_work/Data/Scripts/content/Story/MISSIONS/DIA_Grd_224_Pacho.d:60","Oh.","Och.","","True","Info_Pacho_STOP_15_09","",""
"_work/Data/Scripts/content/Story/MISSIONS/DIA_Grd_224_Pacho.d:61","Gern geschehen!","Vítej!","","True","Info_Pacho_STOP_13_10","",""
"_work/Data/Scripts/content/Story/MISSIONS/DIA_Grd_237_GuardPassage.d:9","OW_PATH_272","OW_PATH_272","","True","Grd_237_CHECKPOINT","",""
"_work/Data/Scripts/content/Story/MISSIONS/DIA_Grd_237_GuardPassage.d:37","Verschwinde hier lieber. Hinter dieser Barrikade beginnt das Orkgebiet!","Neměl bys tu zůstávat. Za tímhle zátarasem začíná země skřetů!","","True","Info_Grd_237_FirstWarn_07_01","",""
"_work/Data/Scripts/content/Story/MISSIONS/DIA_Grd_237_GuardPassage.d:38","Ist das gefährlich?","Je to nebezpečné?","","True","Info_Grd_237_FirstWarn_15_02","",""
"_work/Data/Scripts/content/Story/MISSIONS/DIA_Grd_237_GuardPassage.d:39","Sagen wir's mal so: Da dich die Orks sowieso in Fetzen reißen werden, kannst du uns auch genauso gut all dein Erz geben!","Řekněme to takhle: můžeš mi dát všechnu svoji rudu, než tam půjdeš a skřeti tě rozsápou na kusy!","","True","Info_Grd_237_FirstWarn_07_03","",""
"_work/Data/Scripts/content/Story/MISSIONS/DIA_Grd_237_GuardPassage.d:44","Ich glaube nicht, dass ich das will!","Nemyslím, že to chci udělat!","","True","Info_Grd_237_FirstWarn_Info_NO","",""
"_work/Data/Scripts/content/Story/MISSIONS/DIA_Grd_237_GuardPassage.d:45","Na klar, hier ist mein Erz!","Jistě, tady je moje ruda!","","True","Info_Grd_237_FirstWarn_Info_YES","",""
"_work/Data/Scripts/content/Story/MISSIONS/DIA_Grd_237_GuardPassage.d:46","Ist wohl besser wenn ich wieder umdrehe!","Myslím, že by bylo lepší, kdybych se vrátil.","","True","Info_Grd_237_FirstWarn_Info_RETREAT","",""
"_work/Data/Scripts/content/Story/MISSIONS/DIA_Grd_237_GuardPassage.d:53","Ist wohl besser, wenn ich wieder umdrehe!","Myslím, že by bylo lepší, kdybych se vrátil.","","True","Info_Grd_237_FirstWarn_15_04","",""
"_work/Data/Scripts/content/Story/MISSIONS/DIA_Grd_237_GuardPassage.d:54","Schade, hätte dein Erz gerne verwahrt.","Škoda, rád bych opatroval tvoji rudu.","","True","Info_Grd_237_FirstWarn_07_05","",""
"_work/Data/Scripts/content/Story/MISSIONS/DIA_Grd_237_GuardPassage.d:65","Na klar, hier ist mein Erz!","Jistě, tady je moje ruda!","","True","Info_Grd_237_FirstWarn_15_06","",""
"_work/Data/Scripts/content/Story/MISSIONS/DIA_Grd_237_GuardPassage.d:66","Oh, das ist aber sehr umsichtig von dir.","Och, to je od tebe nesmírně zdvořilé.","","True","Info_Grd_237_FirstWarn_07_07","",""
"_work/Data/Scripts/content/Story/MISSIONS/DIA_Grd_237_GuardPassage.d:82","Ich glaube nicht, dass ich das will!","Nemyslím, že to chci udělat!","","True","Info_Grd_237_FirstWarn_15_08","",""
"_work/Data/Scripts/content/Story/MISSIONS/DIA_Grd_237_GuardPassage.d:83","Dann solltest du besser keinen Schritt mehr weiter tun!","V tom případě bys už neměl udělat ani krok!","","True","Info_Grd_237_FirstWarn_07_09","",""
"_work/Data/Scripts/content/Story/MISSIONS/DIA_Grd_237_GuardPassage.d:116","Bist du taub? Noch ein Schritt und du bist Futter für die Würmer!","Jsi hluchý? Ještě krok a je z tebe potrava pro červy!","","True","Info_Grd_237_LastWarn_07_01","",""
"_work/Data/Scripts/content/Story/MISSIONS/DIA_Grd_245_GuardPassage.d:36","Was ist in diesem Haus?","Co je v tom domě?","","True","DIA_GRD_245_Hello.description","",""
"_work/Data/Scripts/content/Story/MISSIONS/DIA_Grd_245_GuardPassage.d:46","Was ist in diesem Haus?","Co je v tom domu?","","True","DIA_GRD_245_Hello_15_00","",""
"_work/Data/Scripts/content/Story/MISSIONS/DIA_Grd_245_GuardPassage.d:47","Das ist das Haus der Erzbarone. Also wenn du hier reingehst, benimm dich!","To je dům Rudobarona. Pokud chceš jít dál, měl by ses lépe chovat!","","True","DIA_GRD_245_Hello_13_01","",""
"_work/Data/Scripts/content/Story/MISSIONS/DIA_Grd_255_Fletcher.d:50","Hey, du!","Hej, ty!","","True","DIA_Fletcher_First_06_00","",""
"_work/Data/Scripts/content/Story/MISSIONS/DIA_Grd_255_Fletcher.d:51","Wer? Ich?","Kdo? Já?","","True","DIA_Fletcher_First_15_01","",""
"_work/Data/Scripts/content/Story/MISSIONS/DIA_Grd_255_Fletcher.d:52","Du weißt genau, mit wem ich rede, Bürschchen!","Však ty víš, s kým mluvím, zlatíčko!","","True","DIA_Fletcher_First_06_02","",""
"_work/Data/Scripts/content/Story/MISSIONS/DIA_Grd_255_Fletcher.d:53","Ich will dir mal was sagen: Das hier ist MEIN Viertel. Und ich will hier keinen Ärger!","Musím ti něco říci. Tohle je MŮJ obvod a nechci tu žádné problémy!","","True","DIA_Fletcher_First_06_03","",""
"_work/Data/Scripts/content/Story/MISSIONS/DIA_Grd_255_Fletcher.d:54","Aber neue Typen wie du bedeuten immer Ärger. Vor allem, wenn sie hier mitten in der Nacht rumlaufen.","Nováčci jako ty mívají vždycky problémy. Obzvlášť, když se tu motají v noci.","","True","DIA_Fletcher_First_06_04","",""
"_work/Data/Scripts/content/Story/MISSIONS/DIA_Grd_255_Fletcher.d:55","Also, warum sorgst du nicht dafür, dass ich dich hier nicht mehr sehe. Die Hütte gegenüber der Arena mit dem Vordach ist frei. Leg dich 'ne Runde ins Bett.","Tak raději běž, a ať už tě tu nevidím! Naproti aréně je prázdná chatrč, v které je pelest. Trochu se vyspi.","","True","DIA_Fletcher_First_06_05","",""
"_work/Data/Scripts/content/Story/MISSIONS/DIA_Grd_255_Fletcher.d:56","Wenn ich dich in einer der anderen Hütten erwische, zieh ich dir das Fell über die Ohren.","A jestli tě chytím v nějaké jiné chatrči, osobně dohlídnu na to, abys toho litoval.","","True","DIA_Fletcher_First_06_06","",""
"_work/Data/Scripts/content/Story/MISSIONS/DIA_Grd_255_Fletcher.d:87","Hey, du!","Hej, ty!","","True","DIA_Fletcher_Hello_15_00","",""
"_work/Data/Scripts/content/Story/MISSIONS/DIA_Grd_255_Fletcher.d:88","Wenn du dein Schutzgeld loswerden willst - heute ist nicht der Tag.","Jestli jdeš dát peníze za ochranu - pak sis zvolil špatný den.","","True","DIA_Fletcher_Hello_06_01","",""
"_work/Data/Scripts/content/Story/MISSIONS/DIA_Grd_255_Fletcher.d:89","So? Und warum nicht?","Tak? Co to má znamenat?","","True","DIA_Fletcher_Hello_15_02","",""
"_work/Data/Scripts/content/Story/MISSIONS/DIA_Grd_255_Fletcher.d:90","Weil ich gar nicht da bin.","Protože už tady nejsem.","","True","DIA_Fletcher_Hello_06_03","",""
"_work/Data/Scripts/content/Story/MISSIONS/DIA_Grd_255_Fletcher.d:93","Verstehe.","Aha...","","True","DIA_Fletcher_Hello_ISee","",""
"_work/Data/Scripts/content/Story/MISSIONS/DIA_Grd_255_Fletcher.d:94","Wie kommt es dann, dass wir beide uns unterhalten?","Tak jak to, že tady s tebou mluvím?","","True","DIA_Fletcher_Hello_WhyTalk","",""
"_work/Data/Scripts/content/Story/MISSIONS/DIA_Grd_255_Fletcher.d:95","Wo bist du denn?","Och, a kde teda potom jsi?","","True","DIA_Fletcher_Hello_WhereElse","",""
"_work/Data/Scripts/content/Story/MISSIONS/DIA_Grd_255_Fletcher.d:100","Wo bist du denn?","Och, a kde teda potom jsi?","","True","DIA_Fletcher_Hello_WhereElse_15_00","",""
"_work/Data/Scripts/content/Story/MISSIONS/DIA_Grd_255_Fletcher.d:101","Eigentlich bin ich in der Burg, am großen Lagerfeuer, und trinke ein Bier.","Momentálně jsem na hradě, sedím u velkého táborového ohně a piju džbánky piva.","","True","DIA_Fletcher_Hello_WhereElse_06_01","",""
"_work/Data/Scripts/content/Story/MISSIONS/DIA_Grd_255_Fletcher.d:106","Wie kommt es dann, dass wir beide uns unterhalten?","Tak jak to, že tady s tebou mluvím?","","True","DIA_Fletcher_Hello_WhyTalk_15_00","",""
"_work/Data/Scripts/content/Story/MISSIONS/DIA_Grd_255_Fletcher.d:107","Nek ist verschwunden. Er ist normalerweise für dieses Viertel verantwortlich.","Zmizel Nek. Za tenhle obvod obvykle zodpovídá on.","","True","DIA_Fletcher_Hello_WhyTalk_06_01","",""
"_work/Data/Scripts/content/Story/MISSIONS/DIA_Grd_255_Fletcher.d:108","Bis er wieder da ist, hat Thorus MICH hier eingesetzt.","A dokud se znovu neobjeví, Thorus MI přikázal, abych tu dělal stráž.","","True","DIA_Fletcher_Hello_WhyTalk_06_02","",""
"_work/Data/Scripts/content/Story/MISSIONS/DIA_Grd_255_Fletcher.d:115","Verstehe.","Aha.","","True","DIA_Fletcher_Hello_ISee_15_00","",""
"_work/Data/Scripts/content/Story/MISSIONS/DIA_Grd_255_Fletcher.d:130","Weißt du, wo Nek geblieben ist?","Víš, kam zmizel Nek?","","True","DIA_Fletcher_WoNek.description","",""
"_work/Data/Scripts/content/Story/MISSIONS/DIA_Grd_255_Fletcher.d:143","Weißt du, wo Nek geblieben ist?","Víš, kam zmizel Nek?","","True","DIA_Fletcher_WoNek_15_00","",""
"_work/Data/Scripts/content/Story/MISSIONS/DIA_Grd_255_Fletcher.d:144","Nein, und ich werde es auch nicht rausfinden.","Ne, a ani ho nebudu hledat.","","True","DIA_Fletcher_WoNek_06_01","",""
"_work/Data/Scripts/content/Story/MISSIONS/DIA_Grd_255_Fletcher.d:145","Wenn einer was weiß, dann die Buddler aus diesem Viertel. Aber die Buddler reden nicht mit Gardisten.","Pokud by o tom mohl v téhle čtvrti někdo něco vědět, pak jsou to kopáči. Ti ale se strážemi nemluví.","","True","DIA_Fletcher_WoNek_06_02","",""
"_work/Data/Scripts/content/Story/MISSIONS/DIA_Grd_255_Fletcher.d:146","Vor allem nicht jetzt, denn sie wissen, dass ich diese Drecksarbeit hier verabscheue, und insgeheim lachen sie sich über mich tot!","Obzvlášť ne teď, když vědí, jak já tuhle špinavou práci nenávidím. Vsadím se, že se mi vysmívají za zádama.","","True","DIA_Fletcher_WoNek_06_03","",""
"_work/Data/Scripts/content/Story/MISSIONS/DIA_Grd_255_Fletcher.d:150","Die Buddler im Arenaviertel wissen vielleicht, wohin Nek verschwunden ist.","Možná budou kopáči z oblasti arény vědět, kam zmizel Nek.","","True","","","B_LogEntry call."
"_work/Data/Scripts/content/Story/MISSIONS/DIA_Grd_255_Fletcher.d:164","Warum sammelst du nicht trotzdem Schutzgeld?","Proč přesto nevybereš nějaké peníze za ochranu?","","True","DIA_Fletcher_TroSchu.description","",""
"_work/Data/Scripts/content/Story/MISSIONS/DIA_Grd_255_Fletcher.d:177","Warum sammelst du nicht trotzdem Schutzgeld?","Proč přesto nevybereš nějaké peníze za ochranu?","","True","DIA_Fletcher_TroSchu_15_00","",""
"_work/Data/Scripts/content/Story/MISSIONS/DIA_Grd_255_Fletcher.d:178","Kurz bevor er verschwunden ist, hat Nek noch einmal alle kräftig zur Kasse gebeten. Da ist nicht mehr viel zu holen.","Nek už je vybral, než zmizel. Už toho moc nezbylo, aby se ještě vybíralo.","","True","DIA_Fletcher_TroSchu_06_01","",""
"_work/Data/Scripts/content/Story/MISSIONS/DIA_Grd_255_Fletcher.d:194","Wegen Nek...","Co se týče Neka...","","True","DIA_Fletcher_WegenNek.description","",""
"_work/Data/Scripts/content/Story/MISSIONS/DIA_Grd_255_Fletcher.d:207","Wegen Nek ...","Co se týče Neka...","","True","DIA_Fletcher_WegenNek_15_00","",""
"_work/Data/Scripts/content/Story/MISSIONS/DIA_Grd_255_Fletcher.d:208","Ja?","Jistě?","","True","DIA_Fletcher_WegenNek_06_01","",""
"_work/Data/Scripts/content/Story/MISSIONS/DIA_Grd_255_Fletcher.d:214","Ich glaub', ich hab' ihn gefunden.","Myslím, že vím, kde je.","","True","DIA_Fletcher_WegenNek_15_02","",""
"_work/Data/Scripts/content/Story/MISSIONS/DIA_Grd_255_Fletcher.d:215","Was? Wo ist er?","Cože? A kde je?","","True","DIA_Fletcher_WegenNek_06_03","",""
"_work/Data/Scripts/content/Story/MISSIONS/DIA_Grd_255_Fletcher.d:216","Er ist Futter für die Ratten.","Je z něj žrádlo pro krysy...","","True","DIA_Fletcher_WegenNek_15_04","",""
"_work/Data/Scripts/content/Story/MISSIONS/DIA_Grd_255_Fletcher.d:217","Nein! Verdammt! Dann muss ICH jetzt den Laden hier schmeißen. Ich hatte gehofft, er kommt wieder.","Ach ne! Sakra! To znamená, že se tu teď budu muset ukazovat. Doufal jsem, že se vrátí zpátky.","","True","DIA_Fletcher_WegenNek_06_05","",""
"_work/Data/Scripts/content/Story/MISSIONS/DIA_Grd_255_Fletcher.d:218","Jetzt hab' ich ein Problem ...","A máme tu problém.","","True","DIA_Fletcher_WegenNek_06_06","",""
"_work/Data/Scripts/content/Story/MISSIONS/DIA_Grd_255_Fletcher.d:223","Noch nichts Neues.","Žádné zprávy.","","True","DIA_Fletcher_WegenNek_15_07","",""
"_work/Data/Scripts/content/Story/MISSIONS/DIA_Grd_255_Fletcher.d:224","Halt mich auf dem Laufenden.","Pořád mě informuj.","","True","DIA_Fletcher_WegenNek_06_08","",""
"_work/Data/Scripts/content/Story/MISSIONS/DIA_Grd_255_Fletcher.d:239","Was ist dein Problem?","Co je to za problém?","","True","DIA_Fletcher_Problem.description","",""
"_work/Data/Scripts/content/Story/MISSIONS/DIA_Grd_255_Fletcher.d:252","Was ist dein Problem?","Co je to za problém?","","True","DIA_Fletcher_Problem_15_00","",""
"_work/Data/Scripts/content/Story/MISSIONS/DIA_Grd_255_Fletcher.d:253","Ich habe Schulden bei Scatty. 'Ne Menge Schulden. Jetzt, wo er weiß, dass ich Neks Job mache, wird er jeden Tag bei mir auf der Matte stehen ...","Jsem dlužný Scattymu, a to pořádně. Teď se dozví, že dělám Nekovu práci a bude sem chodit každý den...","","True","DIA_Fletcher_Problem_06_01","",""
"_work/Data/Scripts/content/Story/MISSIONS/DIA_Grd_255_Fletcher.d:297","Du hast ziemlich schnell kapiert, wie es hier läuft. Willkommen bei der Garde!","Pochopil jsi rychle, jak to tu chodí. Vítej mezi stráže!","","True","Grd_255_Fletcher_WELCOME_Info_06_01","",""
"_work/Data/Scripts/content/Story/MISSIONS/DIA_Grd_255_Fletcher.d:338","Du Verräter! Na dich haben wir mal zum Gardisten gemacht. PAH!","Zrádce! Myslet si, že necháme takové jako ty, aby se k nám přidali. BRR!","","True","Info_Fletcher_DIE_06_01","",""
"_work/Data/Scripts/content/Story/MISSIONS/DIA_Grd_255_Fletcher.d:342","Da ist noch einer von diesen verräterischen Feuermagiern! PAH!","Je to jeden z těch zrádných mágů Ohně! BRR!","","True","Info_Fletcher_DIE_06_02","",""
"_work/Data/Scripts/content/Story/MISSIONS/DIA_Grd_255_Fletcher.d:346","Hallo Verräter! Auch dein früherer Status als einer von Gomez' Schatten wird dir jetzt nichts mehr helfen!","Zdar, zrádče! To, žes byl jedním z Gomezových Stínů, ti teď nepomůže!","","True","Info_Fletcher_DIE_06_03","",""
"_work/Data/Scripts/content/Story/MISSIONS/DIA_Grd_255_Fletcher.d:349","Moment. Wovon redest du, Fletcher?","Moment. Jak to myslíš, Fletchere?","","True","Info_Fletcher_DIE_15_04","",""
"_work/Data/Scripts/content/Story/MISSIONS/DIA_Grd_255_Fletcher.d:350","Steckst mit diesem abtrünnigen Abschaum aus dem Neuen Lager unter einer Decke, was?","Patříš k té čeládce z Nového tábora, viď?","","True","Info_Fletcher_DIE_06_05","",""
"_work/Data/Scripts/content/Story/MISSIONS/DIA_Grd_255_Fletcher.d:351","Warte mal ...","Zadrž...","","True","Info_Fletcher_DIE_15_06","",""
