"location","source","target","id","fuzzy","context","translator_comments","developer_comments"
"_work/Data/Scripts/content/Story/MISSIONS/DIA_Grd_200_Thorus.d:185","Ich kann alles schaffen, was du mir aufträgst.","Jsem schopný udělat cokoliv, co mi přikážeš.","","True","Info_Thorus_TryMeICanDoIt.description","",""
"_work/Data/Scripts/content/Story/MISSIONS/DIA_Grd_200_Thorus.d:198","Ich kann alles schaffen, was du mir aufträgst.","Jsem schopný udělat cokoliv, co mi přikážeš.","","True","Info_Thorus_TryMeICanDoIt_15_00","",""
"_work/Data/Scripts/content/Story/MISSIONS/DIA_Grd_200_Thorus.d:199","So? Du willst also unbedingt versagen ... Es gibt eine Sache, die nur von jemandem erledigt werden kann, der keiner von Gomez' Leuten ist.","Eh? Vypadá to, že jsi odhodlaný, eh... Je tady jedna věc, kterou může vědět jen někdo, kdo není s Gomezem.","","True","Info_Thorus_TryMeICanDoIt_09_01","",""
"_work/Data/Scripts/content/Story/MISSIONS/DIA_Grd_200_Thorus.d:200","Aber ich warne dich. Wenn du das Ding vermasselst, bekommst du mächtigen Ärger.","Ale varuju tě: jestli to vyzradíš, můžeš se dostat do pěkného maléru!","","True","Info_Thorus_TryMeICanDoIt_09_02","",""
"_work/Data/Scripts/content/Story/MISSIONS/DIA_Grd_200_Thorus.d:218","Ich bin bereit für deine Aufgabe.","Jsem připraven vykonat tvůj úkol.","","True","Info_Thorus_MordragKo_Offer.description","",""
"_work/Data/Scripts/content/Story/MISSIONS/DIA_Grd_200_Thorus.d:231","Ich bin bereit für deine Aufgabe.","Jsem připraven vykonat tvůj úkol.","","True","Info_Thorus_MordragKo_Offer_15_00","",""
"_work/Data/Scripts/content/Story/MISSIONS/DIA_Grd_200_Thorus.d:232","Was ich dir jetzt sage, bleibt unter uns, und niemand außer uns beiden wird je von dieser Sache erfahren, verstanden?","To, co ti teď povím, zůstane jenom mezi náma dvěma a nikdo jiný se o tom nesmí dozvědět, jasný?","","True","Info_Thorus_MordragKo_Offer_09_01","",""
"_work/Data/Scripts/content/Story/MISSIONS/DIA_Grd_200_Thorus.d:233","Ja.","Jasný.","","True","Info_Thorus_MordragKo_Offer_15_02","",""
"_work/Data/Scripts/content/Story/MISSIONS/DIA_Grd_200_Thorus.d:234","Wir haben Ärger mit einem Typen aus dem Neuen Lager. Mordrag ist sein Name. Er hat Eigentum der Erzbarone gestohlen.","Mám potíže s jedním chlapíkem z Nového tábora. Jmenuje se Mordrag. Kradl u Rudobaronů.","","True","Info_Thorus_MordragKo_Offer_09_03","",""
"_work/Data/Scripts/content/Story/MISSIONS/DIA_Grd_200_Thorus.d:235","Es gibt viele Banditen im Neuen Lager, auf die das zutrifft, aber dieser Junge kommt in UNSER Lager und verkauft UNSERE gestohlene Ware an UNSERE Jungs zurück!","Samozřejmě máme v Novém táboře hromadu zabijáků, ale ten chlapík měl takové nervy, že přišel do NAŠEHO tábora a prodával NAŠE zboží NAŠIM lidem!","","True","Info_Thorus_MordragKo_Offer_09_04","",""
"_work/Data/Scripts/content/Story/MISSIONS/DIA_Grd_200_Thorus.d:236","Damit ist er eindeutig zu weit gegangen. Aber er weiß ganz genau, dass ich nichts machen kann.","Zašel moc daleko. Dobře ale ví, že s tím nemůžu nic udělat.","","True","Info_Thorus_MordragKo_Offer_09_05","",""
"_work/Data/Scripts/content/Story/MISSIONS/DIA_Grd_200_Thorus.d:237","Warum?","Jak to?","","True","Info_Thorus_MordragKo_Offer_15_06","",""
"_work/Data/Scripts/content/Story/MISSIONS/DIA_Grd_200_Thorus.d:238","Weil er unter dem Schutz der Magier steht.","Protože je pod ochranou mágů.","","True","Info_Thorus_MordragKo_Offer_09_07","",""
"_work/Data/Scripts/content/Story/MISSIONS/DIA_Grd_200_Thorus.d:241","Ich kümmere mich drum.","Postarám se o to.","","True","Info_Thorus_MordragKo_OFFER_BACK","",""
"_work/Data/Scripts/content/Story/MISSIONS/DIA_Grd_200_Thorus.d:242","Soll ich den Kerl umbringen?","Chceš po mně, abych toho chlapíka zabil?","","True","Info_Thorus_MordragKo_KillHim","",""
"_work/Data/Scripts/content/Story/MISSIONS/DIA_Grd_200_Thorus.d:243","Wo finde ich Mordrag?","Kde Mordraga najdu?","","","Info_Thorus_MordragKo_Where","",""
"_work/Data/Scripts/content/Story/MISSIONS/DIA_Grd_200_Thorus.d:244","Wieso beschützen die Magier diesen Mordrag?","Proč ho mágové ochraňují?","","True","Info_Thorus_MordragKo_MagesProtect","",""
"_work/Data/Scripts/content/Story/MISSIONS/DIA_Grd_200_Thorus.d:245","Klingt eher als wären die Magier dein Problem...","Zdá se, že ti mágové jsou pro tebe problém...","","True","Info_Thorus_MordragKo_MageProblem","",""
"_work/Data/Scripts/content/Story/MISSIONS/DIA_Grd_200_Thorus.d:250","Thorus hat mich damit beauftragt, einen Banditen namens Mordrag aus dem Lager zu vertreiben. Wie ich das anstelle hat er mir überlassen. Außerdem darf niemand erfahren, dass Thorus dahintersteckt.","Thorus mě požádal, abych z tábora vyhnal lumpa jménem Mordrag. Jak to udělám, je prý má věc. Nikdo však nesmí vědět, že za tím stojí Thorus.","","True","","","B_LogEntry call."
"_work/Data/Scripts/content/Story/MISSIONS/DIA_Grd_200_Thorus.d:259","Ich kümmere mich darum.","Postarám se o to.","","True","Info_Thorus_MordragKo_OFFER_BACK_15_00","",""
"_work/Data/Scripts/content/Story/MISSIONS/DIA_Grd_200_Thorus.d:265","Soll ich den Kerl umbringen?","Chceš po mně, abych toho chlapíka zabil?","","True","Info_Thorus_MordragKo_KillHim_15_00","",""
"_work/Data/Scripts/content/Story/MISSIONS/DIA_Grd_200_Thorus.d:266","Du sollst dafür sorgen, dass ich ihn hier nie wieder sehen muss. Wie du das anstellst, ist deine Sache.","Chci, abys zařídil, abych se už na něj nikdy nemusel podívat. Je mi jedno, jak to uděláš.","","True","Info_Thorus_MordragKo_KillHim_09_01","",""
"_work/Data/Scripts/content/Story/MISSIONS/DIA_Grd_200_Thorus.d:271","Wo finde ich Mordrag?","Kde Mordraga najdu?","","True","Info_Thorus_MordragKo_Where_15_00","",""
"_work/Data/Scripts/content/Story/MISSIONS/DIA_Grd_200_Thorus.d:272","Du findest ihn am Südtor, auf der anderen Seite der Burg, direkt hinter dem Eingang. Weiter traut sich dieser Halunke nicht ins Lager.","Najdeš ho u jižní brány na druhé straně hradu, přímo za vstupem. Ten bastard by se už nikdy neměl odvážit přijít do tábora.","","True","Info_Thorus_MordragKo_Where_09_01","",""
"_work/Data/Scripts/content/Story/MISSIONS/DIA_Grd_200_Thorus.d:273","Mordrag hält sich am Südtor auf der Rückseite der Burg auf.","Mordrag je u jižní brány za hradem.","","True","","","B_LogEntry call."
"_work/Data/Scripts/content/Story/MISSIONS/DIA_Grd_200_Thorus.d:278","Wieso beschützen die Magier diesen Mordrag?","Proč ho mágové ochraňují?","","True","Info_Thorus_MordragKo_MagesProtect_15_00","",""
"_work/Data/Scripts/content/Story/MISSIONS/DIA_Grd_200_Thorus.d:279","Weil er als Bote für sie arbeitet. Unsere Magier stehen mit den Magiern des Neuen Lagers in Kontakt. Sie schicken regelmäßig Boten hin und her.","Protože jim slouží jako poslíček. Naši kouzelníci jsou v kontaktu s mágy v Novém táboře. Často posílají poslíčky tam a zpátky.","","True","Info_Thorus_MordragKo_MagesProtect_09_01","",""
"_work/Data/Scripts/content/Story/MISSIONS/DIA_Grd_200_Thorus.d:280","Wenn ich einen ihrer Boten aus dem Lager werfe oder umlegen lasse, könnten sie SEHR unangenehm werden.","Byli by nejspíš HODNĚ rozzlobení, kdybych některého z jejich poslíčků vyhodil z tábora, nebo ho zabil.","","True","Info_Thorus_MordragKo_MagesProtect_09_02","",""
"_work/Data/Scripts/content/Story/MISSIONS/DIA_Grd_200_Thorus.d:281","Was ist mit MIR? Was glaubst du machen die Magier mit MIR?","A co JÁ? Co myslíš, že udělají MNĚ?","","True","Info_Thorus_MordragKo_MagesProtect_15_03","",""
"_work/Data/Scripts/content/Story/MISSIONS/DIA_Grd_200_Thorus.d:282","Du bist neu. Dir passiert gar nichts. ICH dagegen bin für das verantwortlich, was meine Jungs tun. Deswegen ist es ja so wichtig, dass du die Klappe hältst.","Jsi tu nový, můžeš být v klidu. Já ale zodpovídám za to, co dělají moji chlapi. Proto je nesmírně důležité, abys držel jazyk za zuby.","","True","Info_Thorus_MordragKo_MagesProtect_09_04","",""
"_work/Data/Scripts/content/Story/MISSIONS/DIA_Grd_200_Thorus.d:288","Klingt eher, als wären die Magier dein Problem ...","Zdá se, že ti mágové jsou tvůj problém...","","True","Info_Thorus_MordragKo_MageProblem_15_00","",""
"_work/Data/Scripts/content/Story/MISSIONS/DIA_Grd_200_Thorus.d:289","Ja, aber eines, das sich schwer lösen lässt. Vor ein paar Jahren hat mal einer der Schatten versucht, den Obersten Magier des Feuers im Schlaf zu erdolchen.","Jistě, ale jsou takovým problémem, který se těžce řeší. Před pár lety se jeden ze Stínů pokusil ve spánku probodnout Velkého mága Ohnivého kruhu.","","True","Info_Thorus_MordragKo_MageProblem_09_01","",""
"_work/Data/Scripts/content/Story/MISSIONS/DIA_Grd_200_Thorus.d:290","Er wurde später im Außenring gefunden - an VERSCHIEDENEN Stellen im Außenring.","Potom ho našli na Vnějším okruhu - po pravdě řečeno, sbírali ho po CELÉM  Vnějším okruhu.","","True","Info_Thorus_MordragKo_MageProblem_09_02","",""
"_work/Data/Scripts/content/Story/MISSIONS/DIA_Grd_200_Thorus.d:304","Wegen Mordrag...","O Mordragovi...","","True","Info_Thorus_MordragKo_Analyze.description","",""
"_work/Data/Scripts/content/Story/MISSIONS/DIA_Grd_200_Thorus.d:318","Ich kümmere mich drum.","Postarám se o to.","","True","Info_Thorus_MordragKo_ANALYZE_BACK","",""
"_work/Data/Scripts/content/Story/MISSIONS/DIA_Grd_200_Thorus.d:319","Wo finde ich Mordrag?","Kde Mordraga najdu?","","True","Info_Thorus_MordragKo_Where","",""
"_work/Data/Scripts/content/Story/MISSIONS/DIA_Grd_200_Thorus.d:323","Mordrag wird nie wieder irgendwen bestehlen!","Mordrag už nikdy nikomu nic neukradne!","","True","Info_Thorus_MordragKo_MordragDead","",""
"_work/Data/Scripts/content/Story/MISSIONS/DIA_Grd_200_Thorus.d:327","Der Typ wird sich hier nie wieder blicken lassen!","Už se tu nikdy víc neukáže!","","True","Info_Thorus_MordragKo_MordragGone","",""
"_work/Data/Scripts/content/Story/MISSIONS/DIA_Grd_200_Thorus.d:334","Ich kümmere mich drum.","Postarám se o to.","","True","Info_Thorus_MordragKo_ANALYZE_BACK_15_00","",""
"_work/Data/Scripts/content/Story/MISSIONS/DIA_Grd_200_Thorus.d:340","Mordrag wird nie wieder irgendwen bestehlen!","Mordrag už nikdy nikomu nic neukradne!","","True","Info_Thorus_MordragKo_MordragDead_15_00","",""
"_work/Data/Scripts/content/Story/MISSIONS/DIA_Grd_200_Thorus.d:341","Du hast ihn geschafft? Nicht schlecht, Kleiner.","Myslíš tím, žes ho porazil? To není špatné, hochu.","","True","Info_Thorus_MordragKo_MordragDead_09_01","",""
"_work/Data/Scripts/content/Story/MISSIONS/DIA_Grd_200_Thorus.d:344","Thorus war beeindruckt, dass ich Mordrag beseitigt habe. Ein klarer Pluspunkt für mich.","Thorus byl potěšen, že mu Mordrag zmizel z cesty. Výhoda pro mě.","","True","","","B_LogEntry call."
"_work/Data/Scripts/content/Story/MISSIONS/DIA_Grd_200_Thorus.d:352","Der Typ wird sich hier nie wieder blicken lassen!","Už se tu nikdy víc neukáže!","","True","Info_Thorus_MordragKo_MordragGone_15_00","",""
"_work/Data/Scripts/content/Story/MISSIONS/DIA_Grd_200_Thorus.d:353","Lieber wär' mir gewesen, du hättest ihn umgelegt.","Byl bych radši, kdybys ho zabil.","","True","Info_Thorus_MordragKo_MordragGone_09_01","",""
"_work/Data/Scripts/content/Story/MISSIONS/DIA_Grd_200_Thorus.d:356","Thorus ist zufrieden, dass Mordrag nicht mehr hier im Lager ist.","Thorus je rád, že už Mordrag není v táboře.","","True","","","B_LogEntry call."
"_work/Data/Scripts/content/Story/MISSIONS/DIA_Grd_200_Thorus.d:385","Du Versager! Ich sagte doch: NENN MEINEN NAMEN NICHT!!!","Špatně! Říkal jsem ti NEVYSLOVUJ MOJE JMÉNO!!!","","True","Info_Thorus_MordragFailed_09_00","",""
"_work/Data/Scripts/content/Story/MISSIONS/DIA_Grd_200_Thorus.d:386","Du hast es vermasselt! Die Sache kannst du vergessen! Versuche ja nicht, noch weiter daran rumzupfuschen!","Vyzradil jsi to! Na všechno jsi zapomněl! Neopovažuj se už nijak do té záležitosti znovu pouštět!","","True","Info_Thorus_MordragFailed_09_01","",""
"_work/Data/Scripts/content/Story/MISSIONS/DIA_Grd_200_Thorus.d:391","Dass ich Mordrag seinen Namen gesagt habe, hat Thorus gar nicht gefallen. Bei ihm brauche ich mich erstmal nicht mehr sehen lassen.","Thorusovi se nelíbilo, že jsem Mordragovi řekl jeho jméno. Myslím, že bych mu chvíli neměl chodit na oči.","","True","","","B_LogEntry call."
"_work/Data/Scripts/content/Story/MISSIONS/DIA_Grd_200_Thorus.d:406","Würdest du mich für eine entsprechende Menge Erz in die Burg lassen?","Kdybych ti dal určité množství rudy, pustil bys mě na hrad?","","True","Info_Thorus_BribeGuard.description","",""
"_work/Data/Scripts/content/Story/MISSIONS/DIA_Grd_200_Thorus.d:419","Würdest du mich für eine entsprechende Menge Erz in die Burg lassen?","Kdybych ti dal určité množství rudy, pustil bys mě na hrad?","","True","Info_Thorus_BribeGuard_15_00","",""
"_work/Data/Scripts/content/Story/MISSIONS/DIA_Grd_200_Thorus.d:420","Für eine entsprechende Menge ... ","Za určité množství...","","True","Info_Thorus_BribeGuard_09_01","",""
"_work/Data/Scripts/content/Story/MISSIONS/DIA_Grd_200_Thorus.d:421","Wie viel?","Jak velké?","","True","Info_Thorus_BribeGuard_15_02","",""
"_work/Data/Scripts/content/Story/MISSIONS/DIA_Grd_200_Thorus.d:422","Nun - es müsste 'ne Weile dauern, das Erz zu zählen. So lange würden die Jungs am Tor und ich dann wegsehen.","Dobrá - musí být takové, aby se muselo chvíli počítat. Dost dlouho na to, aby bylo jisté, že já i mí chlapi budeme zaměstnaní jeho počítáním, zatímco ty vklouzneš dovnitř.","","True","Info_Thorus_BribeGuard_09_02","",""
"_work/Data/Scripts/content/Story/MISSIONS/DIA_Grd_200_Thorus.d:423","Sag schon, wie viel?","Tak řekni kolik?","","True","Info_Thorus_BribeGuard_15_03","",""
"_work/Data/Scripts/content/Story/MISSIONS/DIA_Grd_200_Thorus.d:424","1000 Brocken dürften genügen.","1000 nugetů by mělo stačit.","","True","Info_Thorus_BribeGuard_09_03","",""
"_work/Data/Scripts/content/Story/MISSIONS/DIA_Grd_200_Thorus.d:425","1000 Brocken?","1000 nugetů?","","True","Info_Thorus_BribeGuard_15_04","",""
"_work/Data/Scripts/content/Story/MISSIONS/DIA_Grd_200_Thorus.d:426","Nun, du könntest dich Gomez' Leuten anschließen, dann kommst du auch in die Burg - ganz umsonst.","Dobře, tak se přidej ke Gomezovi, a budeš mít vstup na hrad zdarma.","","True","Info_Thorus_BribeGuard_09_04","",""
"_work/Data/Scripts/content/Story/MISSIONS/DIA_Grd_200_Thorus.d:440","Ich hab' die 1000 Brocken Erz. Lass mich in die Burg!","Mám 1000 magických nugetů. Teď mě pusť dovnitř!","","True","Info_Thorus_Give1000Ore.description","",""
"_work/Data/Scripts/content/Story/MISSIONS/DIA_Grd_200_Thorus.d:453","Ich hab' die 1000 Brocken Erz. Lass mich in die Burg!","Mám 1000 magických nugetů. Teď mě pusť dovnitř!","","True","Info_Thorus_Give1000Ore_15_00","",""
"_work/Data/Scripts/content/Story/MISSIONS/DIA_Grd_200_Thorus.d:458","Gut, wegen mir. Du kommst in die Burg, aber mach keine Dummheiten, klar!","Dobrá, běž přímo rovně. Můžeš jít do hradu, ale žádné hlouposti, jasný?","","True","Info_Thorus_Give1000Ore_09_01","",""
"_work/Data/Scripts/content/Story/MISSIONS/DIA_Grd_200_Thorus.d:466","Verarsch mich nicht, Kleiner, du hast keine 1000 Brocken Erz!","Nezkoušej na mě žádné triky, chlapče. Ty nemáš žádných 1000 magických nugetů!","","True","Info_Thorus_Give1000Ore_09_02","",""
"_work/Data/Scripts/content/Story/MISSIONS/DIA_Grd_200_Thorus.d:481","Ich muss in die Burg! Ich habe einen Brief für den obersten Feuermagier.","Potřebuju se dostat do hradu! Nesu dopis pro nejvyššího Mága Ohně.","","True","Info_Thorus_LetterForMages.description","",""
"_work/Data/Scripts/content/Story/MISSIONS/DIA_Grd_200_Thorus.d:495","Ich muss in die Burg! Ich habe einen Brief für den obersten Feuermagier.","Potřebuju se dostat do hradu! Nesu dopis pro nejvyššího Mága Ohně.","","True","Info_Thorus_LetterForMages_15_00","",""
"_work/Data/Scripts/content/Story/MISSIONS/DIA_Grd_200_Thorus.d:496","Und ich soll dich jetzt in die Burg spazieren lassen, damit du ihn abgeben und deine Belohnung kassieren kannst?","A ty si myslíš, že tě pustím do hradu, abys ho předal a shrábl odměnu?","","True","Info_Thorus_LetterForMages_09_01","",""
"_work/Data/Scripts/content/Story/MISSIONS/DIA_Grd_200_Thorus.d:497","Ja.","Tak.","","True","Info_Thorus_LetterForMages_15_02","",""
"_work/Data/Scripts/content/Story/MISSIONS/DIA_Grd_200_Thorus.d:498","Na gut, zeig her den Brief.","Dobrá, ukaž mi tu zprávu.","","True","Info_Thorus_LetterForMages_09_03","",""
"_work/Data/Scripts/content/Story/MISSIONS/DIA_Grd_200_Thorus.d:499","Den geb' ich nicht aus der Hand - vergiss es!","Nemůžu ji ukázat TOBĚ - zapomeň na to!","","True","Info_Thorus_LetterForMages_15_04","",""
"_work/Data/Scripts/content/Story/MISSIONS/DIA_Grd_200_Thorus.d:500","Schon vergessen.","Dobře, zapomněl jsem.","","True","Info_Thorus_LetterForMages_09_05","",""
"_work/Data/Scripts/content/Story/MISSIONS/DIA_Grd_200_Thorus.d:514","Diego sagt, ich bin bereit für Gomez!","Diego říká, že můžu vidět Gomeze!","","True","Info_Thorus_ReadyForGomez.description","",""
"_work/Data/Scripts/content/Story/MISSIONS/DIA_Grd_200_Thorus.d:527","Diego sagt, ich bin bereit für Gomez!","Diego říká, že můžu vidět Gomeze!","","True","Info_Thorus_ReadyForGomez_15_00","",""
"_work/Data/Scripts/content/Story/MISSIONS/DIA_Grd_200_Thorus.d:528","Das entscheide immer noch ich!","O tom rozhoduju já!","","True","Info_Thorus_ReadyForGomez_09_01","",""
"_work/Data/Scripts/content/Story/MISSIONS/DIA_Grd_200_Thorus.d:529","Und wie lautet deine Entscheidung?","A jak ses rozhodl?","","True","Info_Thorus_ReadyForGomez_15_02","",""
"_work/Data/Scripts/content/Story/MISSIONS/DIA_Grd_200_Thorus.d:530","Hmmm ...","Hmmm...","","True","Info_Thorus_ReadyForGomez_09_03","",""
"_work/Data/Scripts/content/Story/MISSIONS/DIA_Grd_200_Thorus.d:531","Du hast wohl die meisten Sachen gut gemacht, so viel muss man sagen.","Musím připustit, že svoji práci děláš opravdu dobře.","","True","Info_Thorus_ReadyForGomez_09_04","",""
"_work/Data/Scripts/content/Story/MISSIONS/DIA_Grd_200_Thorus.d:532","Gut! Du kannst zu Gomez gehen. Er allein bestimmt, wer aufgenommen wird und wer nicht.","Dobrá! Můžeš za Gomezem. Sám rozhodne, jestli se k nám přidáš, nebo ne.","","True","Info_Thorus_ReadyForGomez_09_05","",""
"_work/Data/Scripts/content/Story/MISSIONS/DIA_Grd_200_Thorus.d:533","Ab jetzt bist du auf dich allein gestellt, Kleiner.","Od teďka jsi jedním z nás, hochu.","","True","Info_Thorus_ReadyForGomez_09_06","",""
"_work/Data/Scripts/content/Story/MISSIONS/DIA_Grd_200_Thorus.d:554","Ich habe ne Ladung Kraut von Cor Kalom für Gomez.","Mám tady od Cora Kaloma zásilku drogy z bažin pro Gomeze.","","True","Info_Thorus_Krautbote.description","",""
"_work/Data/Scripts/content/Story/MISSIONS/DIA_Grd_200_Thorus.d:567","Ich habe 'ne Ladung Kraut von Cor Kalom für Gomez.","Mám tady od Cora Kaloma pro Gomeze zásilku drogy z bažin.","","True","Info_Thorus_Krautbote_15_00","",""
"_work/Data/Scripts/content/Story/MISSIONS/DIA_Grd_200_Thorus.d:568","Zeig her!","Ukaž mi ji!","","True","Info_Thorus_Krautbote_09_01","",""
"_work/Data/Scripts/content/Story/MISSIONS/DIA_Grd_200_Thorus.d:572","Hmmmmmmm ...","Hmmm...","","True","Info_Thorus_Krautbote_09_02","",""
"_work/Data/Scripts/content/Story/MISSIONS/DIA_Grd_200_Thorus.d:573","Gut! Du kannst durch. Geh direkt zum Haus der Erzbarone. Bartholo wird dich empfangen.","Dobrá! Můžeš dál. Jdi přímo do Rudobaronova domu. Bartholo tě tam bude čekat.","","True","Info_Thorus_Krautbote_09_03","",""
"_work/Data/Scripts/content/Story/MISSIONS/DIA_Grd_200_Thorus.d:584","Du hast zu wenig Kraut für einen Boten! Ich will für dich nicht hoffen, dass du das Zeug verscherbelt hast! Komm wieder, wenn du die richtige Menge dabei hast!","Na poslíčka té drogy moc nemáš! Doufám, žes tu zásilku už nerozprodal někde jinde! Vrať se, až budeš mít to správné množství!","","True","Info_Thorus_Krautbote_09_04","",""
"_work/Data/Scripts/content/Story/MISSIONS/DIA_Grd_200_Thorus.d:601","Ich bin Bote der Wassermagier. Ich muss in die Burg!","Jsem posel mágů Vody. Potřebuju se dostat na hrad!","","True","Info_Thorus_KdWSiegel.description","",""
"_work/Data/Scripts/content/Story/MISSIONS/DIA_Grd_200_Thorus.d:616","Ich bin Bote der Wassermagier. Ich muss in die Burg!","Jsem posel mágů Vody. Potřebuju se dostat na hrad!","","True","Info_Thorus_KdWSiegel_15_00","",""
"_work/Data/Scripts/content/Story/MISSIONS/DIA_Grd_200_Thorus.d:619","Du hast das Amulett eines Boten bei dir. Damit kommst du an den Wachen vorbei.","Máš sebou amulet kurýra. S tím projdeš skrze stáže.","","True","Info_Thorus_KdWSiegel_09_01","",""
"_work/Data/Scripts/content/Story/MISSIONS/DIA_Grd_200_Thorus.d:620","Mit den Magiern will ich nichts zu tun haben. Also belästige mich nicht weiter mit der Sache!","S mágy nechci mít nic společného. Přestaň mě obtěžovat, jo?","","True","Info_Thorus_KdWSiegel_09_02","",""
"_work/Data/Scripts/content/Story/MISSIONS/DIA_Grd_200_Thorus.d:630","Natürlich bist du das. Und dein Amulett hast du verlegt, was?","To jistě jsi. Ale asi jsi musel někde zapomenout amulet kurýra, viď?","","True","Info_Thorus_KdWSiegel_09_03","",""
"_work/Data/Scripts/content/Story/MISSIONS/DIA_Grd_200_Thorus.d:645","Ich hab's geschafft. Jetzt bin ich Mitglied des Lagers!","Vyřízeno. Teď jsem členem tábora.","","True","Info_Thorus_SttGeschafft.description","",""
"_work/Data/Scripts/content/Story/MISSIONS/DIA_Grd_200_Thorus.d:658","Ich hab's geschafft. Jetzt bin ich Mitglied des Lagers!","Vyřízeno. Teď jsem členem tábora.","","True","Info_Thorus_SttGeschafft_15_00","",""
"_work/Data/Scripts/content/Story/MISSIONS/DIA_Grd_200_Thorus.d:659","Herzlichen Glückwunsch, Kleiner! Ab jetzt hältst du dich am besten an Diego.","Gratuluju, hochu! Ode dneška se raději drž v blízkosti Diega.","","True","Info_Thorus_SttGeschafft_09_01","",""
"_work/Data/Scripts/content/Story/MISSIONS/DIA_Grd_200_Thorus.d:660","Zu Gomez oder Raven solltest du nur noch gehen, wenn du was WIRKLICH Wichtiges zu sagen hast.","Musím jen něco OPRAVDU důležitého říci Gomezovi nebo Ravenovi.","","True","Info_Thorus_SttGeschafft_09_02","",""
"_work/Data/Scripts/content/Story/MISSIONS/DIA_Grd_200_Thorus.d:680","Wie sieht's bei dir aus?","Jak to jde?","","True","Info_Thorus_PERM2.description","",""
"_work/Data/Scripts/content/Story/MISSIONS/DIA_Grd_200_Thorus.d:693","Wie sieht's bei dir aus?","Jak se máš?","","True","Info_Thorus_PERM2_15_00","",""
"_work/Data/Scripts/content/Story/MISSIONS/DIA_Grd_200_Thorus.d:694","Wir haben wenig Ärger mit den Typen aus dem Neuen Lager. Mir machen eher die Sektenspinner Sorgen.","S Novým táborem nemáme tolik starostí. Spíš mám obavy z těch sektářských bláznů.","","True","Info_Thorus_PERM2_09_01","",""
"_work/Data/Scripts/content/Story/MISSIONS/DIA_Grd_200_Thorus.d:714","Du wolltest mir etwas mitteilen?","Chceš mi něco říci?","","True","GRD_200_Thorus_GARDIST.description","",""
"_work/Data/Scripts/content/Story/MISSIONS/DIA_Grd_200_Thorus.d:734","Du wolltest mir etwas mitteilen?","Chceš mi něco říci?","","True","GRD_200_Thorus_GARDIST_Info_15_01","",""
"_work/Data/Scripts/content/Story/MISSIONS/DIA_Grd_200_Thorus.d:735","Ja. Durch das, was du in der Mine getan hast, hast du nicht nur deine Tapferkeit, sondern auch deine Stärke und deine Fähigkeit im Kampf unter Beweis gestellt.","Ano. To, jak sis počínal v dolech, nejen dokázalo určitou odvahu, ale také prokázalo tvoji sílu a umění v boji.","","True","GRD_200_Thorus_GARDIST_Info_09_02","",""
"_work/Data/Scripts/content/Story/MISSIONS/DIA_Grd_200_Thorus.d:736","Ich bin bereit, dich in die Reihen der Gardisten aufzunehmen.","Jsem rozhodnutý tě přijmout mezi své stráže.","","True","GRD_200_Thorus_GARDIST_Info_09_03","",""
"_work/Data/Scripts/content/Story/MISSIONS/DIA_Grd_200_Thorus.d:739","Aber du bist noch nicht bereit, Gardist zu werden. Sammle erst noch mehr Erfahrung, dann werde ich dich aufnehmen.","Ale nejsi zatím úplně připravený stát se strážcem. Potřebuješ ještě získat trochu zkušeností, než tě budu moci konečně přijmout.","","True","GRD_200_Thorus_GARDIST_Info_09_04","",""
"_work/Data/Scripts/content/Story/MISSIONS/DIA_Grd_200_Thorus.d:745","Ich gebe dir eine Chance. Wie sieht's aus?","Dávám ti šanci. Co na to říkáš?","","True","GRD_200_Thorus_GARDIST_Info_09_05","",""
"_work/Data/Scripts/content/Story/MISSIONS/DIA_Grd_200_Thorus.d:757","Ich will Gardist werden","Chci se stát strážcem.","","True","GRD_200_Thorus_AUFNAHME.description","",""
"_work/Data/Scripts/content/Story/MISSIONS/DIA_Grd_200_Thorus.d:772","Ich will Gardist werden.","Chci se stát strážcem.","","True","GRD_200_Thorus_AUFNAHME_Info_15_01","",""
"_work/Data/Scripts/content/Story/MISSIONS/DIA_Grd_200_Thorus.d:773","Das freut mich. Doch zunächst: Es gibt da ein paar Dinge, die ich jedem Neuen sage. Pass gut auf, denn ich sage sie nur einmal.","To rád slyším. Nejprve ti ale musím říci něco, co říkám všem adeptům. Poslouchej dobře, protože to budu říkat jenom jednou.","","True","GRD_200_Thorus_AUFNAHME_Info_09_02","",""
"_work/Data/Scripts/content/Story/MISSIONS/DIA_Grd_200_Thorus.d:774","Bisher hast du versucht, auf eigene Faust zu überleben. Damit ist nun Schluss. Meine Jungs halten zusammen. Wir Gardisten beschützen die Erzbarone, das Erz, das Lager und die Mine.","Dosud ses jenom pokoušel stát se jedním z nás. Ty dny jsou už pryč. Mí chlapi drží pohromadě. My, strážci, chráníme Rudobarony, tábor a důl.","","True","GRD_200_Thorus_AUFNAHME_Info_09_03","",""
