"location", "source", "target", "id", "fuzzy", "context", "translator_comments", "developer_comments"
_work/Data/Scripts/content/Story/svm.d:629," ... ich halt' mich da lieber raus ..."," ...udělám nejlíp, když se budu držet dál...",,,SVM_3_Smalltalk04,,
_work/Data/Scripts/content/Story/svm.d:630," ... das ist wirklich nicht mein Problem ..."," ...tohle opravdu není můj problém...",,,SVM_3_Smalltalk05,,
_work/Data/Scripts/content/Story/svm.d:631," ... war doch klar, dass das Ärger gibt ..."," ...bylo jasné, že z toho bude mrzutost...",,,SVM_3_Smalltalk06,,
_work/Data/Scripts/content/Story/svm.d:632," ... aber behalt's für dich, muss nicht gleich jeder wissen ..."," ...nech si to ale pro sebe, lidé to nemusí vědět...",,,SVM_3_Smalltalk07,,
_work/Data/Scripts/content/Story/svm.d:633," ... das passiert mir nicht noch mal ..."," ...už se to znovu nestane...",,,SVM_3_Smalltalk08,,
_work/Data/Scripts/content/Story/svm.d:634," ... an der Geschichte muss wohl doch was dran sein ..."," ...a přesto na tom musí něco být...",,,SVM_3_Smalltalk09,,
_work/Data/Scripts/content/Story/svm.d:635," ... man muss eben aufpassen, was man rumerzählt ..."," ...musíš dávat pozor na to, co lidem říkáš...",,,SVM_3_Smalltalk10,,
_work/Data/Scripts/content/Story/svm.d:636," ... solange ich damit nichts zu tun habe ..."," ...jestli se mě to netýká...",,,SVM_3_Smalltalk11,,
_work/Data/Scripts/content/Story/svm.d:637," ... man darf auch nicht alles glauben, was man hört ..."," ...neměl bys všemu věřit...",,,SVM_3_Smalltalk12,,
_work/Data/Scripts/content/Story/svm.d:638," ... in seiner Haut will ich trotzdem nicht stecken ..."," ...přesto bych nechtěl být v jeho kůži...",,,SVM_3_Smalltalk13,,
_work/Data/Scripts/content/Story/svm.d:639," ... immer wieder dieselbe Leier ..."," ...pořád ta samá pohádka...",,,SVM_3_Smalltalk14,,
_work/Data/Scripts/content/Story/svm.d:640," ... manche lernen eben gar nichts dazu ..."," ...někteří lidé se nikdy nepoučí...",,,SVM_3_Smalltalk15,,
_work/Data/Scripts/content/Story/svm.d:641," ... früher wäre das ganz anders gelaufen ..."," ...dříve bývalo všechno docela jinak...",,,SVM_3_Smalltalk16,,
_work/Data/Scripts/content/Story/svm.d:642," ... gequatscht wird viel ..."," ...lidé říkají...",,,SVM_3_Smalltalk17,,
_work/Data/Scripts/content/Story/svm.d:643," ... ich hör' nicht mehr auf das Gefasel ..."," ...takové řeči já nikdy neposlouchám...",,,SVM_3_Smalltalk18,,
_work/Data/Scripts/content/Story/svm.d:644," ... verlass dich auf jemanden und du bist verlassen, das ist eben so ..."," ...na někoho se spoléháš a dostaneš se do problémů, tak to chodí...",,,SVM_3_Smalltalk19,,
_work/Data/Scripts/content/Story/svm.d:645," ... ich glaube kaum, dass sich daran was ändern wird ..."," ...pochybuji, že by se to mohlo změnit...",,,SVM_3_Smalltalk20,,
_work/Data/Scripts/content/Story/svm.d:646," ... wahrscheinlich hast du Recht ..."," ...máš asi pravdu...",,,SVM_3_Smalltalk21,,
_work/Data/Scripts/content/Story/svm.d:647," ... erst mal abwarten. Es wird längst nichts so heiß gegessen, wie es gekocht wird ..."," ...vydrž. Lepší je do ničeho se nepouštět...",,,SVM_3_Smalltalk22,,
_work/Data/Scripts/content/Story/svm.d:648," ... ich dachte, das wäre schon lange geklärt ..."," ...myslel jsem, že už je to dávno za námi...",,,SVM_3_Smalltalk23,,
_work/Data/Scripts/content/Story/svm.d:649," ... lass uns lieber über was anderes reden ..."," ...pojďme raději mluvit o něčem jiném...",,,SVM_3_Smalltalk24,,
_work/Data/Scripts/content/Story/svm.d:650," Ommm"," Hmmm",,,SVM_3_Om,,
_work/Data/Scripts/content/Story/svm.d:656,Steck lieber die Magie weg!,Přestaň s těmi čáry!,,,SVM_4_StopMagic,,
_work/Data/Scripts/content/Story/svm.d:657,Hör besser auf meinen Rat und steck die Magie weg!,"Uděláš líp, když mě poslechneš a necháš toho čarování!",,,SVM_4_ISaidStopMagic,,
_work/Data/Scripts/content/Story/svm.d:658,"Steck die Waffe weg, wenn du keinen Ärger willst!","Jestli se nechceš dostat do maléru, dej tu zbraň pryč!",,,SVM_4_WeaponDown,,
_work/Data/Scripts/content/Story/svm.d:659,Steck schon endlich die Waffe weg!,Odlož tu zbraň!,,,SVM_4_ISaidWeaponDown,,
_work/Data/Scripts/content/Story/svm.d:660,"Pass lieber auf, wo du hinzielst!","Měl bys dávat pozor, kam míříš!",,,SVM_4_WatchYourAim,,
_work/Data/Scripts/content/Story/svm.d:661,"Wenn du nicht aufhörst, nehme ich dir das Spielzeug weg!","Jestli s tím nepřestaneš, tak ti tu hračku seberu!",,,SVM_4_WatchYourAimAngry,,
_work/Data/Scripts/content/Story/svm.d:662,He da! Pass doch auf!,"Hej, ty tam! Dávej pozor!",,,SVM_4_WhatAreYouDoing,,
_work/Data/Scripts/content/Story/svm.d:663,Vergessen wir unseren kleinen Streit!,Zapomeňme na tohle malé nedorozumění.,,,SVM_4_LetsForgetOurLittleFight,,
_work/Data/Scripts/content/Story/svm.d:664,Komm raus! Zeig dich!,Neschovávej se! Ukaž se!,,,SVM_4_Strange,,
_work/Data/Scripts/content/Story/svm.d:665,"Egal wie viele man tötet, es werden einfach nicht weniger!","Nezáleží na tom, kolik mužů zabiješ. Vždycky přijdou další!",,,SVM_4_DieMonster,,
_work/Data/Scripts/content/Story/svm.d:666,Älter wirst du nicht mehr!,A ty už tu nebudeš!,,,SVM_4_DieMortalEnemy,,
_work/Data/Scripts/content/Story/svm.d:667,"Ich werde dich lehren, dich mit mir anzulegen ...","Radím ti, aby ses se mnou nedostal do křížku...",,,SVM_4_NowWait,,
_work/Data/Scripts/content/Story/svm.d:668,Hast du denn noch nicht genug?,Ty ještě nemáš dost?,,,SVM_4_YouStillNotHaveEnough,,
_work/Data/Scripts/content/Story/svm.d:669,Das hast du dir selbst zuzuschreiben!,Říkáš si o to!,,,SVM_4_YouAskedForIt,,
_work/Data/Scripts/content/Story/svm.d:670,Hier einzudringen war sehr dumm von dir!!,"Bylo od tebe hloupé, že ses sem vetřel!",,,SVM_4_NowWaitIntruder,,
_work/Data/Scripts/content/Story/svm.d:671,Du kannst nicht einfach ungestraft überall rumfummeln!,Nemůžeš se tu motat a nebýt potrestán!,,,SVM_4_IWillTeachYouRespectForForeignProperty,,
_work/Data/Scripts/content/Story/svm.d:672,"Du hat es gewagt, mich zu bestehlen!",Troufl sis mě okrást!,,,SVM_4_DirtyThief,,
_work/Data/Scripts/content/Story/svm.d:673,"Wenn du dich mit uns anlegst, wird dir das nicht gut bekommen.","To, že ses s náma dostal do křížku, ti nic dobrého nepřinese!",,,SVM_4_YouAttackedMyCharge,,
_work/Data/Scripts/content/Story/svm.d:674,Du hast einen von uns getötet! Dein Leben für seins!,Zabil jsi jednoho z nás. Oko za oko!,,,SVM_4_YouKilledOneOfUs,,
_work/Data/Scripts/content/Story/svm.d:675,Aaargl,Aaaaaargl!,,,SVM_4_Dead,,
_work/Data/Scripts/content/Story/svm.d:676,Aargh,Aargh,,,SVM_4_Aargh_1,,
_work/Data/Scripts/content/Story/svm.d:677,Aargh,Aargh,,,SVM_4_Aargh_2,,
_work/Data/Scripts/content/Story/svm.d:678,Aargh,Aargh,,,SVM_4_Aargh_3,,
_work/Data/Scripts/content/Story/svm.d:679,UUAAARRGGGHHH!!!,UUAAARRGGGHHH!!!,,,SVM_4_Berzerk,,
_work/Data/Scripts/content/Story/svm.d:680,Das wirst du noch bereuen!,Toho budeš litovat!,,,SVM_4_YoullBeSorryForThis,,
_work/Data/Scripts/content/Story/svm.d:681,"Nicht aufregen, du hast gewonnen!",Klídek! Zvítězil jsi!,,,SVM_4_YesYes,,
_work/Data/Scripts/content/Story/svm.d:682,Schnell weg von hier!,Padej odsud jak nejrychleji umíš!,,,SVM_4_ShitWhatAMonster,,
_work/Data/Scripts/content/Story/svm.d:683,Ich bin zu alt für so was!,Na to už jsem příliš starý!,,,SVM_4_Help,,
_work/Data/Scripts/content/Story/svm.d:684,Das werde ich nicht so schnell vergessen!,Tohle jen tak nezapomenu!,,,SVM_4_WeWillMeetAgain,,
_work/Data/Scripts/content/Story/svm.d:685,Versuch das besser nicht noch mal!,Tohle už nikdy nezkoušej!,,,SVM_4_NeverTryThatAgain,,
_work/Data/Scripts/content/Story/svm.d:686,Die Waffe nehme ich besser mal mit!,Raději si tu zbraň vezmu sebou!,,,SVM_4_ITakeYourWeapon,,
_work/Data/Scripts/content/Story/svm.d:687,Dein Erz ist bei mir in besseren Händen!,Tvé rudě bude nejlépe v mých rukách!,,,SVM_4_ITookYourOre,,
_work/Data/Scripts/content/Story/svm.d:688,Nicht mal ein paar armselige Erz-Nuggets,Už nikdy takové nedomrlé magické nugety.,,,SVM_4_ShitNoOre,,
_work/Data/Scripts/content/Story/svm.d:689,Finger weg!,Ruce od toho pryč!,,,SVM_4_HandsOff,,
_work/Data/Scripts/content/Story/svm.d:690,Verschwinde hier!,Ztrať se odsuď!,,,SVM_4_GetOutOfHere,,
_work/Data/Scripts/content/Story/svm.d:691,Hier drinnen hast du nichts verloren!,Tady nemáš co dělat!,,,SVM_4_YouViolatedForbiddenTerritory,,
_work/Data/Scripts/content/Story/svm.d:692,Ich bin nicht in der Stimmung für solche Scherze!,Na takovéhle vtipy nemám náladu!,,,SVM_4_YouWannaFoolMe,,
_work/Data/Scripts/content/Story/svm.d:693,"Hey, du! Was schleichst du da rum.","Hej, ty! Co tady pohledáváš?",,,SVM_4_WhatsThisSupposedToBe,,
_work/Data/Scripts/content/Story/svm.d:694,"Geh raus, sonst ruf' ich die Wachen!",Vypadni nebo zavolám stráže!,,,SVM_4_WhyYouAreInHere,,
_work/Data/Scripts/content/Story/svm.d:695,Was hast du da drinnen getrieben?,Cos tady pohledával?,,,SVM_4_WhatDidYouInThere,,
_work/Data/Scripts/content/Story/svm.d:696,Da hast du noch mal Glück gehabt.,Měls štěstí!,,,SVM_4_WiseMove,,
_work/Data/Scripts/content/Story/svm.d:697,"Wachen, hier her!",Stráže! Sem!,,,SVM_4_Alarm,,
_work/Data/Scripts/content/Story/svm.d:698,EINDRINGLING!!!,VETŘELEC!!,,,SVM_4_IntruderAlert,,
_work/Data/Scripts/content/Story/svm.d:699,Hinter dir!,Za tebou!,,,SVM_4_BehindYou,,
_work/Data/Scripts/content/Story/svm.d:700,Schon wieder ein Kampf.,Ještě jednou!,,,SVM_4_TheresAFight,,
_work/Data/Scripts/content/Story/svm.d:701,Fester!,Pořádně!,,,SVM_4_HeyHeyHey,,
_work/Data/Scripts/content/Story/svm.d:702,"Ist das alles, was ihr draufhabt?!","To je všechno, co umíš?",,,SVM_4_CheerFight,,
_work/Data/Scripts/content/Story/svm.d:703,Gib's ihm!,Skonči to s ním!,,,SVM_4_CheerFriend,,
_work/Data/Scripts/content/Story/svm.d:704,Schlag mal zurück!,Vrať mu to!,,,SVM_4_Ooh,,
_work/Data/Scripts/content/Story/svm.d:705,Gut gemacht!,Dobrá práce!,,,SVM_4_YeahWellDone,,
_work/Data/Scripts/content/Story/svm.d:706,Der Feigling verzieht sich!,Ten zbabělec prchá!,,,SVM_4_RunCoward,,
_work/Data/Scripts/content/Story/svm.d:707,Wir haben damals mehr ausgehalten!,Kdysi bývali muži z oceli!,,,SVM_4_HeDefeatedHim,,
_work/Data/Scripts/content/Story/svm.d:708,Selbst schuld!,Tvoje chyba!,,,SVM_4_HeDeservedIt,,
_work/Data/Scripts/content/Story/svm.d:709,Du hast ihn umgebracht! Das war ein großer Fehler!,Proč jsi ho zabil? To byla velká chyba!,,,SVM_4_HeKilledHim,,
_work/Data/Scripts/content/Story/svm.d:710,Früher waren die Kämpfe besser.,"Za starých časů, to se bojovalo jinak!",,,SVM_4_ItWasAGoodFight,,
_work/Data/Scripts/content/Story/svm.d:711,Gäääähn ,Uaah,,,SVM_4_Awake,,
_work/Data/Scripts/content/Story/svm.d:712,Sei gegrüßt.,Nazdar,,,SVM_4_FriendlyGreetings,,
_work/Data/Scripts/content/Story/svm.d:713,Für Gomez!,Za Gomeze!,,,SVM_4_ALGreetings,,
_work/Data/Scripts/content/Story/svm.d:714,Magie zu Ehren!,Za slávu magie!,,,SVM_4_MageGreetings,,
_work/Data/Scripts/content/Story/svm.d:715,Erwache!,Vzbuď se!,,,SVM_4_SectGreetings,,
_work/Data/Scripts/content/Story/svm.d:716,Du findest ihn dort drüben.,Najdeš ho támhle!,,,SVM_4_ThereHeIs,,
_work/Data/Scripts/content/Story/svm.d:717,Ich kann dir nichts beibringen. Du hast nicht genug Erfahrung.,Nemůžu tě nic naučit. Nemáš dost zkušeností.,,,SVM_4_NoLearnNoPoints,,
_work/Data/Scripts/content/Story/svm.d:718,Du bist am Ende deiner Möglichkeiten. Du solltest etwas anderes lernen.,Jsi u konce svých možností. Měl by ses učit něco jiného.,,,SVM_4_NoLearnOverMax,,
_work/Data/Scripts/content/Story/svm.d:719,"Du musst erst fortgeschritten sein, bevor du Meister werden kannst!","Aby ses mohl stát vůdcem, musíš na sobě ještě pracovat!",,,SVM_4_NoLearnYouAlreadyKnow,,
_work/Data/Scripts/content/Story/svm.d:720,Du bist jetzt schon besser!,Už je to s tebou lepší než tehdy!,,,SVM_4_NoLearnYoureBetter,,
_work/Data/Scripts/content/Story/svm.d:721,He da!,"Hej, ty!",,,SVM_4_HeyYou,,
_work/Data/Scripts/content/Story/svm.d:722,Nicht jetzt.,Teď ne!,,,SVM_4_NotNow,,
_work/Data/Scripts/content/Story/svm.d:723,Was willst du?,Co chceš?,,,SVM_4_WhatDoYouWant,,
_work/Data/Scripts/content/Story/svm.d:724,Willst du was von mir?,Něco po mně chceš?,,,SVM_4_ISaidWhatDoYouWant,,
_work/Data/Scripts/content/Story/svm.d:725,Lass mich vorbei.,Nech mě jít!,,,SVM_4_MakeWay,,
_work/Data/Scripts/content/Story/svm.d:726,Mach schon Platz!,Uhni mi z cesty!,,,SVM_4_OutOfMyWay,,
_work/Data/Scripts/content/Story/svm.d:727,"Beiseite, sonst bereust du es!","Uhni mi z cesty, jinak budeš litovat!",,,SVM_4_YouDeafOrWhat,,
_work/Data/Scripts/content/Story/svm.d:728,Willst du dich noch mal mit mir anlegen?,Chceš mít zas se mnou problémy?,,,SVM_4_LookingForTroubleAgain,,
_work/Data/Scripts/content/Story/svm.d:729,"Nichts sehen, nichts hören, nichts reden ...","Nic zlého nevidím, neslyším, neříkám...",,,SVM_4_LookAway,,
_work/Data/Scripts/content/Story/svm.d:730,Behalt es doch einfach!,Tak si jí nech!,,,SVM_4_OkayKeepIt,,
_work/Data/Scripts/content/Story/svm.d:731,Was war denn das?,Co to bylo?,,,SVM_4_WhatsThat,,
_work/Data/Scripts/content/Story/svm.d:732,Rück mal schön meine Waffe wieder raus!,Buď hodnej chlapec a vrať mi mou zbraň!,,,SVM_4_ThatsMyWeapon,,
_work/Data/Scripts/content/Story/svm.d:733,"Los, gib schon her!",Pojď a dej mi ji!,,,SVM_4_GiveItToMe,,
_work/Data/Scripts/content/Story/svm.d:734,"Dann eben nicht! Ich bin froh, dass ich es los bin!","Stejně jsem rád, že jsem se jí zbavil!",,,SVM_4_YouCanKeeptheCrap,,
_work/Data/Scripts/content/Story/svm.d:735,"Wenn ich rauskriege, wer einen von uns auf dem Gewissen hat ...","Jestli zjistím, kdo zabil jednoho z nás...",,,SVM_4_TheyKilledMyFriend,,
_work/Data/Scripts/content/Story/svm.d:736,Du störst meine Nachtruhe!,Rušíš můj odpočinek!,,,SVM_4_YouDisturbedMySlumber,,
_work/Data/Scripts/content/Story/svm.d:737,Du bist umgehauen worden! 'ne kleine Abreibung hattest du auch mal nötig!,Byls poražen! Potřeboval jsi pořádný výprask!,,,SVM_4_SuckerGotSome,,
_work/Data/Scripts/content/Story/svm.d:738,Du hast einen Erzbaron besiegt!,Porazil jsi Rudobarona!,,,SVM_4_SuckerDefeatedEBr,,
_work/Data/Scripts/content/Story/svm.d:739,"Du hast einen der Gurus besiegt. Respekt. Aber lass dir nicht einfallen, das noch mal zu probieren.","Porazil jsi jednoho z Guru. Obdivuhodné, ale už se o to znovu nepokoušej .",,,SVM_4_SuckerDefeatedGur,,
_work/Data/Scripts/content/Story/svm.d:740,Einen Magier zu besiegen ... Du bist einer!,Zvítězit nad mágem... Musíš mít pro strach uděláno!,,,SVM_4_SuckerDefeatedMage,,
_work/Data/Scripts/content/Story/svm.d:741,"Du hast sie ja wohl nicht alle, einfach einen Novizen umhauen.","Musíš být šílený, žes srazil toho novice.",,,SVM_4_SuckerDefeatedNov_Guard,,
_work/Data/Scripts/content/Story/svm.d:742,"Was fällt dir eigentlich ein, einen Buddler zu verkloppen ?","Co sis vlastně myslel, že děláš, když jsi zabíjel kopáče?",,,SVM_4_SuckerDefeatedVlk_Guard,,
_work/Data/Scripts/content/Story/svm.d:743,Du hast dich mit einem Freund von mir angelegt! Du bist wirklich unvorsichtig!,Dostal ses do maléru s jedním z mých přátel! To je dost zlý!,,,SVM_4_YouDefeatedMyComrade,,
_work/Data/Scripts/content/Story/svm.d:744,Vergreif dich noch einmal an einem Novizen und es wird dir Leid tun!,Ještě jednou se dotkneš některého novice a budeš litovat!,,,SVM_4_YouDefeatedNOV_Guard,,
_work/Data/Scripts/content/Story/svm.d:745,"Du bist echt zu mutig, einen meiner Schützlinge anzufassen, kann dich teuer zu stehen kommen.","Jsi příliš smělý, problém s některým z mých chráněnců by pro tebe mohl znamenat nebezpečí.",,,SVM_4_YouDefeatedVLK_Guard,,
_work/Data/Scripts/content/Story/svm.d:746,"Lass bloß die Finger von meinen Sachen, verstanden?","Ruce pryč od mých věcí, jasný?",,,SVM_4_YouStoleFromMe,,
_work/Data/Scripts/content/Story/svm.d:747,"Du hast da etwas, was uns gehört. Gib es uns wieder!","Máš u sebe něco, co patří nám. Vrať nám to!",,,SVM_4_YouStoleFromUs,,
_work/Data/Scripts/content/Story/svm.d:748,Mann! Du hast die Erzbarone beklaut! Die werden toben!,"Člověče, tys kradl u Rudobaronů? Budou vzteky bez sebe!",,,SVM_4_YouStoleFromEBr,,
_work/Data/Scripts/content/Story/svm.d:749,Du hast die Gurus beklaut! Wenn du dich wenigstens nicht erwischen lassen würdest!,Okradl jsi Guru? Nemusel ses aspoň nechat chytit!,,,SVM_4_YouStoleFromGur,,
_work/Data/Scripts/content/Story/svm.d:750,"Die Magier mögen es nicht, wenn man in ihren Sachen rumstöbert!","Mágové nemají rádi lidi, co se motají kolem jejich věcí!",,,SVM_4_StoleFromMage,,
_work/Data/Scripts/content/Story/svm.d:751,Du hast einen von unseren Jungs auf dem Gewissen. Noch ein kleiner Fehler und du bist dran!,Máš na svědomí jednoho z našich mužů. Stačí malá chybička a přijde řada na tebe!,,,SVM_4_YouKilledMyFriend,,
_work/Data/Scripts/content/Story/svm.d:752,"Du hast einen Erzbaron umgelegt! Mann, du bist wohl komplett durchgedreht!?","Zabil jsi jednoho z Rudobaronů! Člověče, úplně ses pominul?",,,SVM_4_YouKilledEBr,,
_work/Data/Scripts/content/Story/svm.d:753,"Du hast einen Guru getötet! Junge, das kann doch nicht wahr sein!",Zabil jsi jednoho z Guru! Nemůžu tomu uvěřit!,,,SVM_4_YouKilledGur,,
_work/Data/Scripts/content/Story/svm.d:754,Du hast einen Magier umgebracht! Wie sollen wir das denn erklären?,Zabil jsi jednoho z mágů! Jak se to chystáš obhájit?,,,SVM_4_YouKilledMage,,
_work/Data/Scripts/content/Story/svm.d:755,Jemand aus dem Alten Lager ist tot und du sollst damit zu tun haben ...,Jeden z členů Starého tábora je mrtev a tvé jméno je spojeno s jeho smrtí...,,,SVM_4_YouKilledOCfolk,,
_work/Data/Scripts/content/Story/svm.d:756,"Im Neuen Lager steht wieder 'ne Hütte leer, und scheinbar hast du damit zu tun!",Nový tábor utrpěl těžkou ztrátu a ty v tom máš prsty!,,,SVM_4_YouKilledNCfolk,,
_work/Data/Scripts/content/Story/svm.d:757,"Die Bruderschaft ist um einen Anhänger ärmer, und wie es scheint, hast du ihn beseitigt!",Bratrstvo ztratilo jednoho ze svých věřících a ty ho máš na svědomí!,,,SVM_4_YouKilledPSIfolk,,
_work/Data/Scripts/content/Story/svm.d:758,Das wieder hinzubiegen wird nicht einfach!,To nebude snadné napravit!,,,SVM_4_GetThingsRight,,
_work/Data/Scripts/content/Story/svm.d:759,"Du hast mir ganz schön aufs Maul gehauen, Mann. War ein guter Kampf. Aber jetzt ist gut!","Pořádně jsi mi to nandal, člověče. Byl to dobrý boj! Ale teď už je konec!",,,SVM_4_YouDefeatedMeWell,,
_work/Data/Scripts/content/Story/svm.d:760," ... wenn du meinst ..."," ...když myslíš...",,,SVM_4_Smalltalk01,,
_work/Data/Scripts/content/Story/svm.d:761," ... kann schon sein ..."," ...možná...",,,SVM_4_Smalltalk02,,
_work/Data/Scripts/content/Story/svm.d:762," ... war nicht besonders schlau ..."," ...to nebylo moc chytré...",,,SVM_4_Smalltalk03,,
_work/Data/Scripts/content/Story/svm.d:763," ... ich halt mich da lieber raus ..."," ...udělám nejlíp, když se budu držet dál...",,,SVM_4_Smalltalk04,,
_work/Data/Scripts/content/Story/svm.d:764," ... das ist wirklich nicht mein Problem ..."," ...tohle opravdu není můj problém...",,,SVM_4_Smalltalk05,,
_work/Data/Scripts/content/Story/svm.d:765," ... war doch klar, dass das Ärger gibt ..."," ...bylo jasné, že z toho bude mrzutost...",,,SVM_4_Smalltalk06,,
_work/Data/Scripts/content/Story/svm.d:766," ... aber behalt's für dich, muss nicht gleich jeder wissen ..."," ...nech si to ale pro sebe, lidé to nemusí vědět...",,,SVM_4_Smalltalk07,,
_work/Data/Scripts/content/Story/svm.d:767," ... das passiert mir nicht noch mal ..."," ...už se to znovu nestane...",,,SVM_4_Smalltalk08,,
_work/Data/Scripts/content/Story/svm.d:768," ... an der Geschichte muss wohl doch was dran sein ..."," ...a přesto na tom musí něco být...",,,SVM_4_Smalltalk09,,
_work/Data/Scripts/content/Story/svm.d:769," ... man muss eben aufpassen, was man rumerzählt ..."," ...musíš dávat pozor na to, co lidem říkáš...",,,SVM_4_Smalltalk10,,
_work/Data/Scripts/content/Story/svm.d:770," ... solange ich damit nichts zu tun habe ..."," ...jestli se mě to netýká...",,,SVM_4_Smalltalk11,,
_work/Data/Scripts/content/Story/svm.d:771," ... man darf auch nicht alles glauben, was man hört ..."," ...neměl bys všemu věřit...",,,SVM_4_Smalltalk12,,
_work/Data/Scripts/content/Story/svm.d:772," ... in seiner Haut will ich trotzdem nicht stecken ..."," ...přesto bych nechtěl být v jeho kůži...",,,SVM_4_Smalltalk13,,
_work/Data/Scripts/content/Story/svm.d:773," ... immer wieder dieselbe Leier ..."," ...pořád ta samá pohádka...",,,SVM_4_Smalltalk14,,
_work/Data/Scripts/content/Story/svm.d:774," ... manche lernen eben gar nichts dazu ..."," ...někteří lidé se nikdy nepoučí...",,,SVM_4_Smalltalk15,,
_work/Data/Scripts/content/Story/svm.d:775," ... früher wäre das ganz anders gelaufen ..."," ...dříve bývalo všechno docela jinak...",,,SVM_4_Smalltalk16,,
_work/Data/Scripts/content/Story/svm.d:776," ... gequatscht wird viel ..."," ...lidé říkají...",,,SVM_4_Smalltalk17,,
_work/Data/Scripts/content/Story/svm.d:777," ... ich hör' nicht mehr auf das Gefasel ..."," ...takové řeči já nikdy neposlouchám...",,,SVM_4_Smalltalk18,,
_work/Data/Scripts/content/Story/svm.d:778," ... verlass dich auf jemanden und du bist verlassen, das ist eben so ..."," ...na někoho se spoléháš a dostaneš se do problémů, tak to chodí...",,,SVM_4_Smalltalk19,,
_work/Data/Scripts/content/Story/svm.d:779," ... ich glaube kaum, dass sich daran was ändern wird ..."," ...pochybuji, že by se to mohlo změnit...",,,SVM_4_Smalltalk20,,
_work/Data/Scripts/content/Story/svm.d:780," ... wahrscheinlich hast du Recht ..."," ...máš asi pravdu...",,,SVM_4_Smalltalk21,,
_work/Data/Scripts/content/Story/svm.d:781," ... erst mal abwarten. Es wird nichts so heiß gegessen, wie es gekocht wird ..."," ...vydrž. Lepší je do ničeho se nepouštět...",,,SVM_4_Smalltalk22,,
_work/Data/Scripts/content/Story/svm.d:782," ... ich dachte, das wäre schon lange geklärt ..."," ...myslel jsem, že už je to dávno za námi...",,,SVM_4_Smalltalk23,,
_work/Data/Scripts/content/Story/svm.d:783," ... lass uns lieber über was anderes reden ..."," ...pojďme raději mluvit o něčem jiném...",,,SVM_4_Smalltalk24,,
_work/Data/Scripts/content/Story/svm.d:784," Ommm",Hmmm,,,SVM_4_Om,,
_work/Data/Scripts/content/Story/svm.d:790,Pack mal lieber die Magie weg!,Žádné čarování!,,,SVM_5_StopMagic,,
_work/Data/Scripts/content/Story/svm.d:791,"Wenn ich 'Magie weg' sage, dann mein' ich das auch so!",Přestaň už s těmi kouzly!,,,SVM_5_ISaidStopMagic,,
_work/Data/Scripts/content/Story/svm.d:792,"Was hast du mit der Waffe vor, Mann!","Co chceš s tou zbraní dělat, člověče?",,,SVM_5_WeaponDown,,
_work/Data/Scripts/content/Story/svm.d:793,"Komm schon, steck weg, das Ding!",Dělej! Dej tu věc pryč!,,,SVM_5_ISaidWeaponDown,,
_work/Data/Scripts/content/Story/svm.d:794,"Du zielst auf mich, du Komiker!","Míříš na mě, ty šašku!",,,SVM_5_WatchYourAim,,
_work/Data/Scripts/content/Story/svm.d:795,"Wenn du nicht aufhörst, dann übe ich gleich auch mal mit dir!","Jestli s tím nepřestaneš, ukážu ti, zač je toho loket!",,,SVM_5_WatchYourAimAngry,,
_work/Data/Scripts/content/Story/svm.d:796,"Hey, bist du blind oder was?","Hej, jseš slepej nebo co?",,,SVM_5_WhatAreYouDoing,,
_work/Data/Scripts/content/Story/svm.d:797,"Den kleinen Streit vergessen wir, okay?","Dobrá, zapomeňme na tuhle hádku, dobrý?",,,SVM_5_LetsForgetOurLittleFight,,
_work/Data/Scripts/content/Story/svm.d:798,Eben war er noch da!? Seltsam! ,Ještě před chvilkou tu byl! To je divné!,,,SVM_5_Strange,,
_work/Data/Scripts/content/Story/svm.d:799,"Du bist fällig, Mistvieh!","Teď je řada na tobě, bastarde!",,,SVM_5_DieMonster,,
_work/Data/Scripts/content/Story/svm.d:800,Jetzt wird abgerechnet!,Vyrovnáme účty!,,,SVM_5_DieMortalEnemy,,
_work/Data/Scripts/content/Story/svm.d:801,Du brauchst wohl dringend was hinter die Ohren!,Říkáš si o pořádnou nakládačku!,,,SVM_5_NowWait,,
_work/Data/Scripts/content/Story/svm.d:802,Hast du immer noch nicht genug?,Ty nemáš ještě dost?,,,SVM_5_YouStillNotHaveEnough,,
_work/Data/Scripts/content/Story/svm.d:803,"Na gut, du willst es scheinbar so!",Dobrá! Říkal sis o to!,,,SVM_5_YouAskedForIt,,
_work/Data/Scripts/content/Story/svm.d:804,Hier werden sie dich raustragen müssen!,Nemáš tu co pohledávat!,,,SVM_5_NowWaitIntruder,,
_work/Data/Scripts/content/Story/svm.d:805,"Ich hab' dich gewarnt. Wer an meine Sachen geht, kriegt Ärger!","Varoval jsem tě. Jestli se dotkneš mých věcí, lítáš v průšvihu!",,,SVM_5_IWillTeachYouRespectForForeignProperty,,
_work/Data/Scripts/content/Story/svm.d:806,Du Dieb! Ich bring dir Manieren bei!,Zloději! Však já tě naučím!,,,SVM_5_DirtyThief,,
_work/Data/Scripts/content/Story/svm.d:807,Niemand vergreift sich ungestraft an meinen Jungs!,"Není nikdo, kdo by měl problém s mými lidmi a pak toho nelitoval!",,,SVM_5_YouAttackedMyCharge,,
_work/Data/Scripts/content/Story/svm.d:808,Du hast einen meiner Jungs platt gemacht. Jetzt mach' ich DICH platt!,Zabil jsi jednoho z mých chlapů. Teď zabiju já TEBE!,,,SVM_5_YouKilledOneOfUs,,
_work/Data/Scripts/content/Story/svm.d:809,Aaargl,Aaargl,,,SVM_5_Dead,,
_work/Data/Scripts/content/Story/svm.d:810,Aargh,Aargh,,,SVM_5_Aargh_1,,
_work/Data/Scripts/content/Story/svm.d:811,Aargh,Aargh,,,SVM_5_Aargh_2,,
_work/Data/Scripts/content/Story/svm.d:812,Aargh,Aargh,,,SVM_5_Aargh_3,,
_work/Data/Scripts/content/Story/svm.d:813,UUAAARRGGGHHH!!!,UUAAARRGGGHHH!!!,,,SVM_5_Berzerk,,
_work/Data/Scripts/content/Story/svm.d:814,Das wird dir noch Leid tun!,Toho budeš litovat!,,,SVM_5_YoullBeSorryForThis,,
_work/Data/Scripts/content/Story/svm.d:815,Bleib locker! Hast gewonnen.,Vyhrál jsi! Dobrá!,,,SVM_5_YesYes,,
