"location", "source", "target", "id", "fuzzy", "context", "translator_comments", "developer_comments"
_work/Data/Scripts/content/Story/svm.d:1745,Hier werden sie dich raustragen müssen!,Oni tě odsud vynesou!,,,SVM_12_NowWaitIntruder,,
_work/Data/Scripts/content/Story/svm.d:1746,"Ich hab' dich gewarnt. Wer an meine Sachen geht, kriegt Ärger!","Varoval jsem tě. Jestli se dotkneš mých věcí, lítáš v průšvihu!",,,SVM_12_IWillTeachYouRespectForForeignProperty,,
_work/Data/Scripts/content/Story/svm.d:1747,Du Dieb! Ich bring' dir Manieren bei!,Ty všivej zloději! Já tě naučím!,,,SVM_12_DirtyThief,,
_work/Data/Scripts/content/Story/svm.d:1748,Niemand vergreift sich ungestraft an meinen Jungs!,"Není nikdo, kdo by měl problém s mými lidmi a pak toho nelitoval!",,,SVM_12_YouAttackedMyCharge,,
_work/Data/Scripts/content/Story/svm.d:1749,Du hast einen meiner Jungs platt gemacht. Jetzt mach' ich DICH platt!,Zabil jsi jednoho z nás! Teď zabiju já TEBE!,,,SVM_12_YouKilledOneOfUs,,
_work/Data/Scripts/content/Story/svm.d:1750,Aaargl,Aaargl,,,SVM_12_Dead,,
_work/Data/Scripts/content/Story/svm.d:1751,Aargh,Aargh,,,SVM_12_Aargh_1,,
_work/Data/Scripts/content/Story/svm.d:1752,Aargh,Aargh,,,SVM_12_Aargh_2,,
_work/Data/Scripts/content/Story/svm.d:1753,Aargh,Aargh,,,SVM_12_Aargh_3,,
_work/Data/Scripts/content/Story/svm.d:1754,UUAAARRGGGHHH!!!,UUAAARRGGGHHH!!!,,,SVM_12_Berzerk,,
_work/Data/Scripts/content/Story/svm.d:1755,Das wird dir noch Leid tun!,Toho budeš litovat!,,,SVM_12_YoullBeSorryForThis,,
_work/Data/Scripts/content/Story/svm.d:1756,Bleib locker! Hast gewonnen.,"Klid, klid, vyhrál jsi!",,,SVM_12_YesYes,,
_work/Data/Scripts/content/Story/svm.d:1757,Das ist 'ne Nummer zu groß! Ich hau ab!,To je na mě moc! Na to nestačím!,,,SVM_12_ShitWhatAMonster,,
_work/Data/Scripts/content/Story/svm.d:1758,Verdammt!,K čertu!,,,SVM_12_Help,,
_work/Data/Scripts/content/Story/svm.d:1759,Beim nächsten Mal sieht die Sache anders aus!,Ještě se uvidíme!,,,SVM_12_WeWillMeetAgain,,
_work/Data/Scripts/content/Story/svm.d:1760,Versuch das nicht noch mal!,Už to znova nezkoušej!,,,SVM_12_NeverTryThatAgain,,
_work/Data/Scripts/content/Story/svm.d:1761,Die Waffe gefällt mir!,Tahle zbraň se mi líbí!,,,SVM_12_ITakeYourWeapon,,
_work/Data/Scripts/content/Story/svm.d:1762,"Ich sorg dafür, dass dein Erz gut angelegt wird!","Podívám se, jak je tvá ruda dobře uložená!",,,SVM_12_ITookYourOre,,
_work/Data/Scripts/content/Story/svm.d:1763,Mist! Kein Erz!,K čertu! Žádná ruda!,,,SVM_12_ShitNoOre,,
_work/Data/Scripts/content/Story/svm.d:1764,Finger weg!,Ruce od toho pryč!,,,SVM_12_HandsOff,,
_work/Data/Scripts/content/Story/svm.d:1765,Raus hier!,Vypadni odsud!,,,SVM_12_GetOutOfHere,,
_work/Data/Scripts/content/Story/svm.d:1766,Hey! Wo kommst du denn her?,Hej! Jak ses sem dostal?,,,SVM_12_YouViolatedForbiddenTerritory,,
_work/Data/Scripts/content/Story/svm.d:1767,Hältst du mich für so dämlich?!,"Myslíš, že jsem tak hloupý?",,,SVM_12_YouWannaFoolMe,,
_work/Data/Scripts/content/Story/svm.d:1768,Weshalb schleichst du hier rum?,Co tady pohledáváš?,,,SVM_12_WhatsThisSupposedToBe,,
_work/Data/Scripts/content/Story/svm.d:1769,"Raus hier, sonst rufe ich die Wachen!",Vypadni odsud nebo zavolám stráže!,,,SVM_12_WhyYouAreInHere,,
_work/Data/Scripts/content/Story/svm.d:1770,Du hast da drinnen nichts verloren!,Tady nemáš co dělat!,,,SVM_12_WhatDidYouInThere,,
_work/Data/Scripts/content/Story/svm.d:1771,Du lernst schnell!,Učíš se rychle!,,,SVM_12_WiseMove,,
_work/Data/Scripts/content/Story/svm.d:1772,"Wachen, hierher!",Stráže! Sem!,,,SVM_12_Alarm,,
_work/Data/Scripts/content/Story/svm.d:1773,ALARM!!!!,POZOR!!,,,SVM_12_IntruderAlert,,
_work/Data/Scripts/content/Story/svm.d:1774,"Hey, pass auf!",Za tebou!,,,SVM_12_BehindYou,,
_work/Data/Scripts/content/Story/svm.d:1775,Ein Kampf!,Do boje!,,,SVM_12_TheresAFight,,
_work/Data/Scripts/content/Story/svm.d:1776,Drauf!,Pořádně!,,,SVM_12_HeyHeyHey,,
_work/Data/Scripts/content/Story/svm.d:1777,Gut so!,Výborně!,,,SVM_12_CheerFight,,
_work/Data/Scripts/content/Story/svm.d:1778,Hau ihn endlich um!,Vyřiď ho!,,,SVM_12_CheerFriend,,
_work/Data/Scripts/content/Story/svm.d:1779,Pass doch auf!,Tak dávej pozor!,,,SVM_12_Ooh,,
_work/Data/Scripts/content/Story/svm.d:1780,Wurde aber auch Zeit!,Už bylo na čase!,,,SVM_12_YeahWellDone,,
_work/Data/Scripts/content/Story/svm.d:1781,Der Typ verdrückt sich!,Ten chlapík utíká pryč!,,,SVM_12_RunCoward,,
_work/Data/Scripts/content/Story/svm.d:1782,"Klarer Sieger, würde ich sagen!","Jasný vítěz, jak jsem řek!",,,SVM_12_HeDefeatedHim,,
_work/Data/Scripts/content/Story/svm.d:1783,Es hat den Richtigen erwischt!,Zasloužil si to!,,,SVM_12_HeDeservedIt,,
_work/Data/Scripts/content/Story/svm.d:1784,Einfach einen kaltmachen. Du hast jetzt echt ein Problem!,Akorát zabíjíš lidi. Máš teď pořádnej problém.,,,SVM_12_HeKilledHim,,
_work/Data/Scripts/content/Story/svm.d:1785,Was für ein Kampf!,Skvělý boj!,,,SVM_12_ItWasAGoodFight,,
_work/Data/Scripts/content/Story/svm.d:1786,Gäääähn ,Uuaah,,,SVM_12_Awake,,
_work/Data/Scripts/content/Story/svm.d:1787,"Hallo, Freund!",Nazdar,,,SVM_12_FriendlyGreetings,,
_work/Data/Scripts/content/Story/svm.d:1788,Für Gomez!,Za Gomeze!,,,SVM_12_ALGreetings,,
_work/Data/Scripts/content/Story/svm.d:1789,Magie zu Ehren!,Za slávu magie,,,SVM_12_MageGreetings,,
_work/Data/Scripts/content/Story/svm.d:1790,Erwache!,Probuď se!,,,SVM_12_SectGreetings,,
_work/Data/Scripts/content/Story/svm.d:1791,Da drüben.,Támhle!,,,SVM_12_ThereHeIs,,
_work/Data/Scripts/content/Story/svm.d:1792,"So unerfahren, wie du bist, kann ich dir nichts beibringen.",Nemůžu tě nic naučit. Nemáš dost zkušeností..,,,SVM_12_NoLearnNoPoints,,
_work/Data/Scripts/content/Story/svm.d:1793,Du bist am Ende deiner Möglichkeiten. Du solltest etwas anderes lernen.,Jsi u konce svých možností. Měl by ses učit něco jiného.,,,SVM_12_NoLearnOverMax,,
_work/Data/Scripts/content/Story/svm.d:1794,"Du musst erst fortgeschritten sein, bevor du Meister werden kannst!","Aby ses mohl stát vůdcem, musíš na sobě ještě pracovat!",,,SVM_12_NoLearnYouAlreadyKnow,,
_work/Data/Scripts/content/Story/svm.d:1795,Du bist jetzt schon besser!,Už je to s tebou lepší!,,,SVM_12_NoLearnYoureBetter,,
_work/Data/Scripts/content/Story/svm.d:1796,Hey du!,"Hej, ty!",,,SVM_12_HeyYou,,
_work/Data/Scripts/content/Story/svm.d:1797,Nicht jetzt.,Teď ne!,,,SVM_12_NotNow,,
_work/Data/Scripts/content/Story/svm.d:1798,Kann ich dir helfen?,Můžu ti pomoci?,,,SVM_12_WhatDoYouWant,,
_work/Data/Scripts/content/Story/svm.d:1799,Was willst du?,Co chceš?,,,SVM_12_ISaidWhatDoYouWant,,
_work/Data/Scripts/content/Story/svm.d:1800,Lass mich mal durch.,Nech mě jít!,,,SVM_12_MakeWay,,
_work/Data/Scripts/content/Story/svm.d:1801,"Na los, lass mich vorbei!","Dělej, uhni mi z cesty!",,,SVM_12_OutOfMyWay,,
_work/Data/Scripts/content/Story/svm.d:1802,Bist du taub oder suchst du Streit?,Jseš hluchej nebo toužíš po maléru?,,,SVM_12_YouDeafOrWhat,,
_work/Data/Scripts/content/Story/svm.d:1803,Willst du dich noch mal mit mir anlegen?,Chceš mít zas se mnou problémy?,,,SVM_12_LookingForTroubleAgain,,
_work/Data/Scripts/content/Story/svm.d:1804,War irgendwas? Ich hab' NICHTS gesehen ...,Stalo se něco? Neviděl jsem NIC...,,,SVM_12_LookAway,,
_work/Data/Scripts/content/Story/svm.d:1805,"Schon gut, behalt es!",Dobrá! Tak si ji nech!,,,SVM_12_OkayKeepIt,,
_work/Data/Scripts/content/Story/svm.d:1806,Was war denn das?,Co to bylo?,,,SVM_12_WhatsThat,,
_work/Data/Scripts/content/Story/svm.d:1807,"Ich würde es vorziehen, meine Waffe zurückzubekommen!",Opravdu chci svoji zbraň zpátky!,,,SVM_12_ThatsMyWeapon,,
_work/Data/Scripts/content/Story/svm.d:1808,Gib schon her!,Tak dej mi ji!,,,SVM_12_GiveItToMe,,
_work/Data/Scripts/content/Story/svm.d:1809,"Na ja, auch nicht so schlimm! Ich hab' noch mehr davon!","Hm, není špatná! Sehnal jsem další!",,,SVM_12_YouCanKeeptheCrap,,
_work/Data/Scripts/content/Story/svm.d:1810,Sie haben einen unserer Jungs erwischt. Wenn ich das Schwein kriege ...,Dostali jednoho z našich kluků. Jestli já toho lotra...,,,SVM_12_TheyKilledMyFriend,,
_work/Data/Scripts/content/Story/svm.d:1811,"Hm, was soll denn das? Warum weckst du mich?","Hm, co to je? Proč mě budíš?",,,SVM_12_YouDisturbedMySlumber,,
_work/Data/Scripts/content/Story/svm.d:1812,Na? Haste was aufs Maul gekriegt? Geschieht dir Recht!,Eh? Dostal jsi nakládačku? Dobře ti tak!,,,SVM_12_SuckerGotSome,,
_work/Data/Scripts/content/Story/svm.d:1813,Du hast einen Erzbaron umgehauen. Er war beeindruckt!,Porazil jsi Rudobarona! Má na tebe vztek!,,,SVM_12_SuckerDefeatedEBr,,
_work/Data/Scripts/content/Story/svm.d:1814,"Du hast einen der Gurus besiegt. Respekt. Aber lass dir nicht einfallen, das noch mal zu probieren.","Porazil jsi jednoho z Guru. Skvělé, ale už se o to znovu nepokoušej.",,,SVM_12_SuckerDefeatedGur,,
_work/Data/Scripts/content/Story/svm.d:1815,Einen Magier zu besiegen ... Du bist ja einer!,Zvítězit nad mágem... Musíš mít pro strach uděláno!,,,SVM_12_SuckerDefeatedMage,,
_work/Data/Scripts/content/Story/svm.d:1816,"Du hast sie ja wohl nicht alle, einfach einen Novizen umzuhauen.","Musíš být šílený, žes srazil toho novice.",,,SVM_12_SuckerDefeatedNov_Guard,,
_work/Data/Scripts/content/Story/svm.d:1817,"Was fällt dir eigentlich ein, einen Buddler zu verkloppen?","Co sis vlastně myslel, že děláš, když jsi zabíjel kopáče?",,,SVM_12_SuckerDefeatedVlk_Guard,,
_work/Data/Scripts/content/Story/svm.d:1818,"Du hast einen Kumpel von mir ausgeknockt, was sollte das?","Srazil jsi mého přítele, proč?",,,SVM_12_YouDefeatedMyComrade,,
_work/Data/Scripts/content/Story/svm.d:1819,Vergreif dich noch einmal an unseren Jungs und es wird dir Leid tun.,Ještě jednou se dotkneš některého novice a budeš litovat!,,,SVM_12_YouDefeatedNOV_Guard,,
_work/Data/Scripts/content/Story/svm.d:1820,"Du bist echt zu mutig, einen meiner Schützlinge anzufassen, kann dich teuer zu stehen kommen.","Jsi příliš smělý, problém s některým z mých chráněnců by pro tebe mohl znamenat nebezpečí.",,,SVM_12_YouDefeatedVLK_Guard,,
_work/Data/Scripts/content/Story/svm.d:1821,"Du wagst es mir unter die Augen zu treten, dreckiger Dieb?","Jak se sem opovažuješ vrátit, ty zloději?",,,SVM_12_YouStoleFromMe,,
_work/Data/Scripts/content/Story/svm.d:1822,"Du hast einige Sachen, die uns gehören. Gib sie besser wieder her.","Máš něco, co patří nám. Měl bys nám to vrátit.",,,SVM_12_YouStoleFromUs,,
_work/Data/Scripts/content/Story/svm.d:1823,Mann! Du hast die Erzbarone beklaut! Die werden toben!,"Člověče, tys kradl u Rudobaronů? Budou vzteky bez sebe!",,,SVM_12_YouStoleFromEBr,,
_work/Data/Scripts/content/Story/svm.d:1824,Du hast die Gurus beklaut! Wenn du dich wenigstens nicht erwischen lassen würdest!,Kradl jsi u Guru! Nemusel ses aspoň nechat nachytat!,,,SVM_12_YouStoleFromGur,,
_work/Data/Scripts/content/Story/svm.d:1825,"Die Magier mögen es nicht, wenn man in ihren Sachen rumstöbert!","Mágové nemají rádi lidi, co se motají kolem jejich věcí!",,,SVM_12_StoleFromMage,,
_work/Data/Scripts/content/Story/svm.d:1826,Du hast einen von unseren Jungs auf dem Gewissen. Noch ein kleiner Fehler und du bist dran!,Máš na svědomí jednoho z našich mužů. Stačí malá chybička a přijde řada na tebe!,,,SVM_12_YouKilledMyFriend,,
_work/Data/Scripts/content/Story/svm.d:1827,"Du hast einen Erzbaron umgelegt! Mann, du bist wohl komplett durchgedreht!?","Zabil jsi jednoho z Rudobaronů! Člověče, úplně ses pominul?",,,SVM_12_YouKilledEBr,,
_work/Data/Scripts/content/Story/svm.d:1828,"Du hast einen Guru getötet! Junge, das kann doch nicht wahr sein!","Zabil jsi jednoho z Guru! Tomu, hochu, nemůžu uvěřit!",,,SVM_12_YouKilledGur,,
_work/Data/Scripts/content/Story/svm.d:1829,Du hast einen Magier umgebracht! Wie sollen wir das denn erklären?,Zabil jsi jednoho z mágů! Jak se to chystáš obhájit?,,,SVM_12_YouKilledMage,,
_work/Data/Scripts/content/Story/svm.d:1830,Jemand aus dem Alten Lager ist tot und du sollst damit zu tun haben ...,Jeden z členů Starého tábora je mrtev a tvoje jméno je spojeno s jeho smrtí...,,,SVM_12_YouKilledOCfolk,,
_work/Data/Scripts/content/Story/svm.d:1831,"Das Neue Lager hat einen tragischen Verlust erlitten, und scheinbar hast du damit zu tun!",Nový tábor utrpěl těžkou ztrátu a ty v tom máš prsty!,,,SVM_12_YouKilledNCfolk,,
_work/Data/Scripts/content/Story/svm.d:1832,"Die Bruderschaft ist um einen Anhänger ärmer, und wie es scheint, hast du ihn beseitigt!",Bratrstvo ztratilo jednoho ze svých věřících a ty ho máš na svědomí!,,,SVM_12_YouKilledPSIfolk,,
_work/Data/Scripts/content/Story/svm.d:1833,Das wieder hinzubiegen wird nicht einfach!,To nebude snadné napravit!,,,SVM_12_GetThingsRight,,
_work/Data/Scripts/content/Story/svm.d:1834,"Du hast mir ganz schön aufs Maul gehauen, Mann. War ein guter Kampf. Aber jetzt ist gut!","Pořádně jsi mi to nandal, člověče. Byl to dobrý boj! Ale teď už je konec!",,,SVM_12_YouDefeatedMeWell,,
_work/Data/Scripts/content/Story/svm.d:1835," ... wenn du meinst ..."," ...když myslíš...",,,SVM_12_Smalltalk01,,
_work/Data/Scripts/content/Story/svm.d:1836," ... kann schon sein ..."," ...možná...",,,SVM_12_Smalltalk02,,
_work/Data/Scripts/content/Story/svm.d:1837," ... war nicht besonders schlau ..."," ...to nebylo moc chytré...",,,SVM_12_Smalltalk03,,
_work/Data/Scripts/content/Story/svm.d:1838," ... ich halt mich da lieber raus ..."," ...udělám nejlíp, když se budu držet dál...",,,SVM_12_Smalltalk04,,
_work/Data/Scripts/content/Story/svm.d:1839," ... das ist wirklich nicht mein Problem ..."," ...tohle opravdu není můj problém...",,,SVM_12_Smalltalk05,,
_work/Data/Scripts/content/Story/svm.d:1840," ... war doch klar, dass das Ärger gibt ..."," ...bylo jasné, že z toho bude mrzutost...",,,SVM_12_Smalltalk06,,
_work/Data/Scripts/content/Story/svm.d:1841," ... aber behalt's für dich, muss nicht gleich jeder wissen ..."," ...nech si to ale pro sebe, lidé to nemusí vědět...",,,SVM_12_Smalltalk07,,
_work/Data/Scripts/content/Story/svm.d:1842," ... das passiert mir nicht noch mal ..."," ...už se to znovu nestane...",,,SVM_12_Smalltalk08,,
_work/Data/Scripts/content/Story/svm.d:1843," ... an der Geschichte muss wohl doch was dran sein ..."," ...a přesto na tom musí něco být...",,,SVM_12_Smalltalk09,,
_work/Data/Scripts/content/Story/svm.d:1844," ... man muss eben aufpassen, was man rumerzählt ..."," ...musíš dávat pozor na to, co lidem říkáš...",,,SVM_12_Smalltalk10,,
_work/Data/Scripts/content/Story/svm.d:1845," ... solange ich damit nichts zu tun habe ..."," ...jestli se mě to netýká...",,,SVM_12_Smalltalk11,,
_work/Data/Scripts/content/Story/svm.d:1846," ... man darf auch nicht alles glauben, was man hört ..."," ...neměl bys všemu věřit...",,,SVM_12_Smalltalk12,,
_work/Data/Scripts/content/Story/svm.d:1847," ... in seiner Haut will ich trotzdem nicht stecken ..."," ...přesto bych nechtěl být v jeho kůži...",,,SVM_12_Smalltalk13,,
_work/Data/Scripts/content/Story/svm.d:1848," ... immer wieder dieselbe Leier ..."," ...pořád ta samá pohádka...",,,SVM_12_Smalltalk14,,
_work/Data/Scripts/content/Story/svm.d:1849," ... manche lernen eben gar nichts dazu ..."," ...někteří lidé se nikdy nepoučí...",,,SVM_12_Smalltalk15,,
_work/Data/Scripts/content/Story/svm.d:1850," ... früher wäre das ganz anders gelaufen ..."," ...dříve bývalo všechno docela jinak...",,,SVM_12_Smalltalk16,,
_work/Data/Scripts/content/Story/svm.d:1851," ... gequatscht wird viel ..."," ...lidé říkají...",,,SVM_12_Smalltalk17,,
_work/Data/Scripts/content/Story/svm.d:1852," ... ich hör' nicht mehr auf das Gefasel ..."," ...takové řeči já nikdy neposlouchám...",,,SVM_12_Smalltalk18,,
_work/Data/Scripts/content/Story/svm.d:1853," ... verlass dich auf jemanden und du bist verlassen, das ist eben so ..."," ...na někoho se spoléháš a dostaneš se do problémů, tak to chodí...",,,SVM_12_Smalltalk19,,
_work/Data/Scripts/content/Story/svm.d:1854," ... ich glaube kaum, dass sich daran was ändern wird  ..."," ...pochybuji, že by se to mohlo změnit...",,,SVM_12_Smalltalk20,,
_work/Data/Scripts/content/Story/svm.d:1855," ... wahrscheinlich hast du Recht ..."," ...máš asi pravdu...",,,SVM_12_Smalltalk21,,
_work/Data/Scripts/content/Story/svm.d:1856," ... erst mal abwarten. Es wird nichts so heiß gegessen, wie es gekocht wird ..."," ...vydrž. Lepší je do ničeho se nepouštět...",,,SVM_12_Smalltalk22,,
_work/Data/Scripts/content/Story/svm.d:1857," ... ich dachte, das wäre schon lange geklärt ..."," ...myslel jsem, že už je to dávno za námi...",,,SVM_12_Smalltalk23,,
_work/Data/Scripts/content/Story/svm.d:1858," ... lass uns lieber über was anderes reden ..."," ...pojďme raději mluvit o něčem jiném...",,,SVM_12_Smalltalk24,,
_work/Data/Scripts/content/Story/svm.d:1859,Ommm,Hmmm,,,SVM_12_Om,,
_work/Data/Scripts/content/Story/svm.d:1865,Steck die Magie weg!,Přestaň už s těmi kouzly!,,,SVM_13_StopMagic,,
_work/Data/Scripts/content/Story/svm.d:1866,"Pack sie weg, WEG!!",Dej to pryč! IHNED!,,,SVM_13_ISaidStopMagic,,
_work/Data/Scripts/content/Story/svm.d:1867,Die Waffe weg!,Polož tu zbraň!,,,SVM_13_WeaponDown,,
_work/Data/Scripts/content/Story/svm.d:1868,Weg mit der Waffe!,Polož tu zbraň!,,,SVM_13_ISaidWeaponDown,,
_work/Data/Scripts/content/Story/svm.d:1869,Auf mich zielen? Pass auf du!,Ty na mě míříš? Dej si pozor!,,,SVM_13_WatchYourAim,,
_work/Data/Scripts/content/Story/svm.d:1870,Du bist auf dem besten Wege zu sterben. Ziel gefälligst woanders hin!,Jdeš si rovnou pro smrt! Měl bys raději mířit jinam!,,,SVM_13_WatchYourAimAngry,,
_work/Data/Scripts/content/Story/svm.d:1871,Was soll das werden?!,Co to mělo znamenat?,,,SVM_13_WhatAreYouDoing,,
_work/Data/Scripts/content/Story/svm.d:1872,"Den Streit vergessen wir, okay?","Dobrá, zapomeňme na tuhle hádku, dobrý?",,,SVM_13_LetsForgetOurLittleFight,,
_work/Data/Scripts/content/Story/svm.d:1873,Wo ist er hin? Das kann nicht sein!,Kam se poděl? To není možné!,,,SVM_13_Strange,,
_work/Data/Scripts/content/Story/svm.d:1874,Heute Abend gibt es Fleisch!,Dnes večer budeme mít maso!,,,SVM_13_DieMonster,,
_work/Data/Scripts/content/Story/svm.d:1875,Du bist dran! Keine Gnade!,Teď je řada na tobě! Bez milosti!,,,SVM_13_DieMortalEnemy,,
_work/Data/Scripts/content/Story/svm.d:1876,Das gibt Prügel ...,To znamená pořádný výprask!,,,SVM_13_NowWait,,
_work/Data/Scripts/content/Story/svm.d:1877,Du willst es doch wohl nicht noch mal versuchen?,Už to znova nezkoušej! Jasný?,,,SVM_13_YouStillNotHaveEnough,,
_work/Data/Scripts/content/Story/svm.d:1878,Du wolltest es so!,Sám jsi to chtěl!,,,SVM_13_YouAskedForIt,,
_work/Data/Scripts/content/Story/svm.d:1879,"Jetzt gehts dir an den Kragen, Eindringling!","Nemáš tu co pohledávat, vetřelče!",,,SVM_13_NowWaitIntruder,,
_work/Data/Scripts/content/Story/svm.d:1880,Die Finger sollte ich dir abschneiden!,Asi tě budu muset praštit přes prsty!,,,SVM_13_IWillTeachYouRespctForForeignProperty,,
_work/Data/Scripts/content/Story/svm.d:1881,Dreckiger Dieb! Ich werde dir die Hände brechen ...,Zloději prašivej! Zpřerážím ti hnáty...,,,SVM_13_DirtyThief,,
_work/Data/Scripts/content/Story/svm.d:1882,"Wenn hier jemand Prügel austeilt, bin ich das!","Tady se nikdo nikoho nedotkne, s výjimkou mě!",,,SVM_13_YouAttackedMyCharge,,
_work/Data/Scripts/content/Story/svm.d:1883,Du hast einen von uns gekillt!,Zabil jsi jednoho z nás!,,,SVM_13_YouKilledOneOfUs,,
_work/Data/Scripts/content/Story/svm.d:1884,Aaargl,Aaargl,,,SVM_13_Dead,,
_work/Data/Scripts/content/Story/svm.d:1885,Aargh,Aargh,,,SVM_13_Aargh_1,,
_work/Data/Scripts/content/Story/svm.d:1886,Aargh,Aargh,,,SVM_13_Aargh_2,,
_work/Data/Scripts/content/Story/svm.d:1887,Aargh,Aargh,,,SVM_13_Aargh_3,,
_work/Data/Scripts/content/Story/svm.d:1888,UUAAARRGGGHHH!!!,UUAAARRGGGHHH!!!,,,SVM_13_Berzerk,,
_work/Data/Scripts/content/Story/svm.d:1889,"Du wirst wenig Zeit haben, das zu bereuen!",Nebudeš mít moc času toho litovat!,,,SVM_13_YoullBeSorryForThis,,
_work/Data/Scripts/content/Story/svm.d:1890,"Kein Problem, es gibt kein Problem!","Nic se neděje, vůbec nic!",,,SVM_13_YesYes,,
_work/Data/Scripts/content/Story/svm.d:1891,Ich hab' nicht die richtige Waffe. Wir sehen uns ...,Nemám tu správnou zbraň. Ještě se uvidíme...,,,SVM_13_ShitWhatAMonster,,
_work/Data/Scripts/content/Story/svm.d:1892,Woooooaaahhh! Weg hier!,Uuuuaaaaahh! Zmiz!,,,SVM_13_Help,,
_work/Data/Scripts/content/Story/svm.d:1893,Wir sprechen uns noch!,Ještě se uvidíme!,,,SVM_13_WeWillMeetAgain,,
_work/Data/Scripts/content/Story/svm.d:1894,Beim nächsten Mal bring ich dich um!,Příště tě zabiju!,,,SVM_13_NeverTryThatAgain,,
_work/Data/Scripts/content/Story/svm.d:1895,Nette Waffe! Gehört die dir? Nein? Okay!,Pěkná zbraň! Tvoje? Ne? Dobrá!,,,SVM_13_ITakeYourWeapon,,
_work/Data/Scripts/content/Story/svm.d:1896,"Du hast bestimmt nichts dagegen, wenn ich etwas Erz behalte.","Doufám, že se na mě nenaštveš, když si vezmu trochu rudy.",,,SVM_13_ITookYourOre,,
_work/Data/Scripts/content/Story/svm.d:1897,Du hast je nicht mal etwas Erz in den Taschen!,Ty už nemáš ani kousek rudy!,,,SVM_13_ShitNoOre,,
_work/Data/Scripts/content/Story/svm.d:1898,Du Ratte! Finger weg! Dir zeig' ich's!,"Ty kryso! Ruce pryč, nebo tě zabiju!",,,SVM_13_HandsOff,,
_work/Data/Scripts/content/Story/svm.d:1899,Verzieh Dich! Raus hier!,Padej odsud! Kliď se odsuď!,,,SVM_13_GetOutOfHere,,
_work/Data/Scripts/content/Story/svm.d:1900,Was machst du denn hier?,Co tady pohledáváš?,,,SVM_13_YouViolatedForbiddenTerritory,,
_work/Data/Scripts/content/Story/svm.d:1901,Du versuchst tatsächlich mich zu verarschen!,Ty se mě snad snažíš přechytračit?,,,SVM_13_YouWannaFoolMe,,
_work/Data/Scripts/content/Story/svm.d:1902,Hey du! Was schleichst du da rum?,"Hej, ty! Co tady pohledáváš?",,,SVM_13_WhatsThisSupposedToBe,,
_work/Data/Scripts/content/Story/svm.d:1903,Was machst du hier? Geh oder ich ruf die Wachen!,Co tady děláš? Upaluj nebo zavolám stráže!,,,SVM_13_WhyYouAreInHere,,
_work/Data/Scripts/content/Story/svm.d:1904,Du hast da drinnen nichts zu suchen!,Tady nemáš co dělat!,,,SVM_13_WhatDidYouInThere,,
_work/Data/Scripts/content/Story/svm.d:1905,Dein Glück! Aber ich hätte dir auch gerne die Fresse poliert!,Máš štěstí! Nejradši bych ti dal jednu po tlamě!,,,SVM_13_WiseMove,,
_work/Data/Scripts/content/Story/svm.d:1906,"Wachen, zu mir!",Stráže! Sem!,,,SVM_13_Alarm,,
_work/Data/Scripts/content/Story/svm.d:1907,ALARM!!,POZOR!!,,,SVM_13_IntruderAlert,,
_work/Data/Scripts/content/Story/svm.d:1908,Hinter dir!,Za tebou!,,,SVM_13_BehindYou,,
_work/Data/Scripts/content/Story/svm.d:1909,"Mal sehen, wer gleich Staub schluckt.","Uvidíme, kdo bude žrát hlínu první.",,,SVM_13_TheresAFight,,
_work/Data/Scripts/content/Story/svm.d:1910,"Ja, noch mal!",Výborně! Ještě!,,,SVM_13_HeyHeyHey,,
_work/Data/Scripts/content/Story/svm.d:1911,Ich will Blut sehen!,Chci vidět krev!,,,SVM_13_CheerFight,,
_work/Data/Scripts/content/Story/svm.d:1912,Mach ihn fertig!!,Ukaž mu!,,,SVM_13_CheerFriend,,
_work/Data/Scripts/content/Story/svm.d:1913,"Wehr Dich, du Flasche!","Stáhni se, idiote!",,,SVM_13_Ooh,,
_work/Data/Scripts/content/Story/svm.d:1914,Jaaaa!!!,Uuaahh!!!,,,SVM_13_YeahWellDone,,
_work/Data/Scripts/content/Story/svm.d:1915,"Ja, verschwinde!","Uahh, upaluj pryč!",,,SVM_13_RunCoward,,
_work/Data/Scripts/content/Story/svm.d:1916,Kümmerliche Vorstellung! Ein kleiner Windstoß und er wäre auch umgefallen.,Trapné vystoupení! Slabounký závan větru a uletěl jako věchet slámy!,,,SVM_13_HeDefeatedHim,,
_work/Data/Scripts/content/Story/svm.d:1917,"Pah, geschieht ihm recht!",Uh! Nandej mu to!,,,SVM_13_HeDeservedIt,,
_work/Data/Scripts/content/Story/svm.d:1918,"Du bist wirklich lebensmüde, vor Zeugen jemand kalt zu machen.","To je sebevražda, zabít někoho před svědky!",,,SVM_13_HeKilledHim,,
_work/Data/Scripts/content/Story/svm.d:1919,Netter Kampf!,Pěkný boj!,,,SVM_13_ItWasAGoodFight,,
_work/Data/Scripts/content/Story/svm.d:1920,Gääähn!!,Uuahh,,,SVM_13_Awake,,
_work/Data/Scripts/content/Story/svm.d:1921,Alles klar bei dir?,Jsi v pořádku?,,,SVM_13_FriendlyGreetings,,
_work/Data/Scripts/content/Story/svm.d:1922,Für Gomez!,Za Gomeze!,,,SVM_13_ALGreetings,,
_work/Data/Scripts/content/Story/svm.d:1923,Magie zu Ehren!,Za slávu magie!,,,SVM_13_MageGreetings,,
_work/Data/Scripts/content/Story/svm.d:1924,Erwache!,Vzbuď se!,,,SVM_13_SectGreetings,,
_work/Data/Scripts/content/Story/svm.d:1925,Bist du blind? Da vorne!,Jsi slepý? Támhle!,,,SVM_13_ThereHeIs,,
_work/Data/Scripts/content/Story/svm.d:1926,Ich kann dir nichts beibringen. Du hast nicht genug Erfahrung.,Nemůžu tě nic naučit. Nemáš dost zkušeností.,,,SVM_13_NoLearnNoPoints,,
_work/Data/Scripts/content/Story/svm.d:1927,Du bist am Ende deiner Möglichkeiten. Du solltest etwas anderes lernen.,Jsi u konce svých možností. Měl by ses učit něco jiného.,,,SVM_13_NoLearnOverMax,,
_work/Data/Scripts/content/Story/svm.d:1928,"Du musst erst fortgeschritten sein, bevor du Meister werden kannst!","Aby ses mohl stát vůdcem, musíš na sobě ještě pracovat!",,,SVM_13_NoLearnYouAlreadyKnow,,
_work/Data/Scripts/content/Story/svm.d:1929,Du bist jetzt schon besser!,Už je to s tebou lepší!,,,SVM_13_NoLearnYoureBetter,,
_work/Data/Scripts/content/Story/svm.d:1930,Hey du!,"Hej, ty!",,,SVM_13_HeyYou,,
_work/Data/Scripts/content/Story/svm.d:1931,Nicht jetzt!,Teď ne!,,,SVM_13_NotNow,,
_work/Data/Scripts/content/Story/svm.d:1932,Was willst du von mir?,Chceš ode mě něco?,,,SVM_13_WhatDoYouWant,,
_work/Data/Scripts/content/Story/svm.d:1933,Kann ich was für dich tun?!,Můžu pro tebe něco udělat?,,,SVM_13_ISaidWhatDoYouWant,,
_work/Data/Scripts/content/Story/svm.d:1934,Lass mich vorbei.,Nech mě jít!,,,SVM_13_MakeWay,,
