"location","source","target","id","fuzzy","context","translator_comments","developer_comments"
"_work/Data/Scripts/content/Story/svm.d:1599","Wenn du Streit suchst, komm ruhig näher!","If you're looking for trouble just come here!","","","SVM_11_WeaponDown","",""
"_work/Data/Scripts/content/Story/svm.d:1600","Steck das Ding weg, oder du bist dran!","Put that thing away or you're done for!","","","SVM_11_ISaidWeaponDown","",""
"_work/Data/Scripts/content/Story/svm.d:1601","Nimm das Ding runter!","Put that thing down!","","","SVM_11_WatchYourAim","",""
"_work/Data/Scripts/content/Story/svm.d:1602","Du willst dich also mit mir anlegen? Bist du sicher?","So you want trouble with me? Are you sure?","","","SVM_11_WatchYourAimAngry","",""
"_work/Data/Scripts/content/Story/svm.d:1603","Was machst du! Lass das!","What are you doing! Stop it!","","","SVM_11_WhatAreYouDoing","",""
"_work/Data/Scripts/content/Story/svm.d:1604","Gut, vergessen wir unseren kleinen Streit.","Okay, let's forget about our little argument.","","","SVM_11_LetsForgetOurLittleFight","",""
"_work/Data/Scripts/content/Story/svm.d:1605","Mmh! Mist! Wo ist er abgeblieben?","Mmh! Damn! Where did he get to?","","","SVM_11_Strange","",""
"_work/Data/Scripts/content/Story/svm.d:1606","Die werden aussterben, wenn sie mir ständig über den Weg laufen!","They'll die out if they keep crossing my path!","","","SVM_11_DieMonster","",""
"_work/Data/Scripts/content/Story/svm.d:1607","Wer sich Todfeinde macht, muss auch damit umgehen können, stirb.","If you make enemies you need to be able to handle them. Die.","","","SVM_11_DieMortalEnemy","",""
"_work/Data/Scripts/content/Story/svm.d:1608","Das hättest du nicht tun sollen!","You shouldn't have done that!","","","SVM_11_NowWait","",""
"_work/Data/Scripts/content/Story/svm.d:1609","Hab' ich dich nicht schon mal in den Staub getreten? Auf ein Neues ...","Didn't I knock you into the dust once? Here we go again ...","","","SVM_11_YouStillNotHaveEnough","",""
"_work/Data/Scripts/content/Story/svm.d:1610","Wer nicht hören will, muss fühlen!","If you don't listen, you gonna come to grief!","","","SVM_11_YouAskedForIt","",""
"_work/Data/Scripts/content/Story/svm.d:1611","He Eindringling. Nun kommt deine Lektion!","Hey intruder. Now your lesson is coming!","","","SVM_11_NowWaitIntruder","",""
"_work/Data/Scripts/content/Story/svm.d:1612","Ich muss dir wohl auf die Flossen hauen!","Suppose I'll have to smack your fingers for you!","","","SVM_11_IWillTeachYouRespectForForeignProperty","",""
"_work/Data/Scripts/content/Story/svm.d:1613","Diebstahl lohnt nicht!","Theft is not worthwhile!","","","SVM_11_DirtyThief","",""
"_work/Data/Scripts/content/Story/svm.d:1614","Du bringst Unruhe in meinen Bereich! Jetzt muss ich dich fertig machen!","You are unsettling my area! Now I need to finish you off!","","","SVM_11_YouAttackedMyCharge","",""
"_work/Data/Scripts/content/Story/svm.d:1615","Einen von uns umzubringen war dein letzter Fehler!","Killing one of us has been your last mistake!","","","SVM_11_YouKilledOneOfUs","",""
"_work/Data/Scripts/content/Story/svm.d:1616","Aaargl","Aaargl","","","SVM_11_Dead","",""
"_work/Data/Scripts/content/Story/svm.d:1617","Aargh","Aargh","","","SVM_11_Aargh_1","",""
"_work/Data/Scripts/content/Story/svm.d:1618","Aargh","Aargh","","","SVM_11_Aargh_2","",""
"_work/Data/Scripts/content/Story/svm.d:1619","Aargh","Aargh","","","SVM_11_Aargh_3","",""
"_work/Data/Scripts/content/Story/svm.d:1620","UUAAARRGGGHHH!!!","UUAAARRGGGHHH!!!","","","SVM_11_Berzerk","",""
"_work/Data/Scripts/content/Story/svm.d:1621","Das hättest du besser nicht getan!","You shouldn't have done that!","","","SVM_11_YoullBeSorryForThis","",""
"_work/Data/Scripts/content/Story/svm.d:1622","Schon gut! Du hast ja gewonnen!","Okay, okay! You win!","","","SVM_11_YesYes","",""
"_work/Data/Scripts/content/Story/svm.d:1623","Dieses Vieh ist eine Nummer zu groß für mich!","This one's too big for me!","","","SVM_11_ShitWhatAMonster","",""
"_work/Data/Scripts/content/Story/svm.d:1624","Rückzug!","Retreat!","","","SVM_11_Help","",""
"_work/Data/Scripts/content/Story/svm.d:1625","Das hat noch ein Nachspiel, Freundchen.","That'll have consequences, pal!","","","SVM_11_WeWillMeetAgain","",""
"_work/Data/Scripts/content/Story/svm.d:1626","Versuch das nicht noch einmal!","Don't try that again!","","","SVM_11_NeverTryThatAgain","",""
"_work/Data/Scripts/content/Story/svm.d:1627","Deine Waffe ist bei mir besser aufgehoben!","I'll take better care of your weapon than you have done!","","","SVM_11_ITakeYourWeapon","",""
"_work/Data/Scripts/content/Story/svm.d:1628","Nett, dass du mir etwas von deinem Erz überlässt!","Nice of you to leave me some of your ore!","","","SVM_11_ITookYourOre","",""
"_work/Data/Scripts/content/Story/svm.d:1629","Fehlanzeige, kein Erz!","Nothing, no ore!","","","SVM_11_ShitNoOre","",""
"_work/Data/Scripts/content/Story/svm.d:1630","Nimm deine Griffel weg!","Get your dirty hands off!","","","SVM_11_HandsOff","",""
"_work/Data/Scripts/content/Story/svm.d:1631","Raus hier, sonst mach' ich dir Beine!","Out of here or I'll make you run!","","","SVM_11_GetOutOfHere","",""
"_work/Data/Scripts/content/Story/svm.d:1632","Hey, wie kommst DU hier rein?","Hey, how did YOU get in here?","","","SVM_11_YouViolatedForbiddenTerritory","",""
"_work/Data/Scripts/content/Story/svm.d:1633","Nicht mit mir, Freundchen!","Not with me, mate!","","","SVM_11_YouWannaFoolMe","",""
"_work/Data/Scripts/content/Story/svm.d:1634","Was wird das denn, wenn's fertig ist?","What's that supposed to be?","","","SVM_11_WhatsThisSupposedToBe","",""
"_work/Data/Scripts/content/Story/svm.d:1635","Die Hütte gehört mir. Raus oder ich ruf die Wachen!","The hut's mine. Out or I'll call the guards!","","","SVM_11_WhyYouAreInHere","",""
"_work/Data/Scripts/content/Story/svm.d:1636","Was wolltest du da drin? Verschwinde, bevor ich mich mit dir beschäftige!","What were you doing in there? Beat it before I beat you!","","","SVM_11_WhatDidYouInThere","",""
"_work/Data/Scripts/content/Story/svm.d:1637","Gut! Mach das nicht noch mal!","Good! Don't do that again!","","","SVM_11_WiseMove","",""
"_work/Data/Scripts/content/Story/svm.d:1638","Wachen, hier her!","Guards! Over here!","","","SVM_11_Alarm","",""
"_work/Data/Scripts/content/Story/svm.d:1639","ALARM!!! EINDRINGLING!!!","ALERT!!! INTRUDER!!!","","","SVM_11_IntruderAlert","",""
"_work/Data/Scripts/content/Story/svm.d:1640","Hinter dir!","Behind you!","","","SVM_11_BehindYou","",""
"_work/Data/Scripts/content/Story/svm.d:1641","Mal sehen, wer diesmal gewinnt!","Let's see who's winning this time!","","","SVM_11_TheresAFight","",""
"_work/Data/Scripts/content/Story/svm.d:1642","Na los, mach schon!","Come on, do it!","","","SVM_11_HeyHeyHey","",""
"_work/Data/Scripts/content/Story/svm.d:1643","Hör auf, mit ihm zu spielen!","Stop playing with him!","","","SVM_11_CheerFight","",""
"_work/Data/Scripts/content/Story/svm.d:1644","Na, mit dem wirst du doch wohl noch fertig!","Oh come on, you can handle him, can't you?","","","SVM_11_CheerFriend","",""
"_work/Data/Scripts/content/Story/svm.d:1645","Ouh! Nicht gut!","Ouh! Not so good!","","","SVM_11_Ooh","",""
"_work/Data/Scripts/content/Story/svm.d:1646","Mmh! Nicht schlecht.","Mmh! Not bad.","","","SVM_11_YeahWellDone","",""
"_work/Data/Scripts/content/Story/svm.d:1647","Lass dich hier nie mehr blicken!","Never show your face here again!","","","SVM_11_RunCoward","",""
"_work/Data/Scripts/content/Story/svm.d:1648","Der hat gesessen!","That was good hit!","","","SVM_11_HeDefeatedHim","",""
"_work/Data/Scripts/content/Story/svm.d:1649","Macht nix! Er hat's verdient!","Doesn't matter! He deserved it!","","","SVM_11_HeDeservedIt","",""
"_work/Data/Scripts/content/Story/svm.d:1650","Du hast ihn getötet! Das gibt großen Ärger!","You've killed him! That spells big trouble!","","","SVM_11_HeKilledHim","",""
"_work/Data/Scripts/content/Story/svm.d:1651","Gut gemacht! Eine saubere Vorstellung!","Well done! A neat performance!","","","SVM_11_ItWasAGoodFight","",""
"_work/Data/Scripts/content/Story/svm.d:1652","Gäääähn","Yawn","","","SVM_11_Awake","",""
"_work/Data/Scripts/content/Story/svm.d:1653","Hallo.","Hello.","","","SVM_11_FriendlyGreetings","",""
"_work/Data/Scripts/content/Story/svm.d:1654","Für Gomez!","For Gomez!","","","SVM_11_ALGreetings","",""
"_work/Data/Scripts/content/Story/svm.d:1655","Magie zu Ehren!","For the honor of magic!","","","SVM_11_MageGreetings","",""
"_work/Data/Scripts/content/Story/svm.d:1656","Erwache!","Awaken!","","","SVM_11_SectGreetings","",""
"_work/Data/Scripts/content/Story/svm.d:1657","Bist du blind? Da vorne! //*** 11er war falsch betont!***","Are you blind? Over there!","","","SVM_13_ThereHeIs","",""
"_work/Data/Scripts/content/Story/svm.d:1658","Ich kann dir nichts beibringen. Du hast nicht genug Erfahrung.","I can't teach you anything. You don't have enough experience.","","","SVM_11_NoLearnNoPoints","",""
"_work/Data/Scripts/content/Story/svm.d:1659","Du bist am Ende deiner Möglichkeiten. Du solltest etwas anderes lernen.","You're at the end of your possibilities. You should learn something different.","","","SVM_11_NoLearnOverMax","",""
"_work/Data/Scripts/content/Story/svm.d:1660","Du musst erst fortgeschritten sein, bevor du Meister werden kannst!","You need to become advanced before you can become a master!","","","SVM_11_NoLearnYouAlreadyKnow","",""
"_work/Data/Scripts/content/Story/svm.d:1661","Du bist jetzt schon besser!","You're better than that already!","","","SVM_11_NoLearnYoureBetter","",""
"_work/Data/Scripts/content/Story/svm.d:1662","Heh, du!","Heh, you!","","","SVM_11_HeyYou","",""
"_work/Data/Scripts/content/Story/svm.d:1663","Nicht jetzt.","Not now.","","","SVM_11_NotNow","",""
"_work/Data/Scripts/content/Story/svm.d:1664","Was willst du?","What do you want?","","","SVM_11_WhatDoYouWant","",""
"_work/Data/Scripts/content/Story/svm.d:1665","Kann ich was für dich tun?","Can I do anything for you?","","","SVM_11_ISaidWhatDoYouWant","",""
"_work/Data/Scripts/content/Story/svm.d:1666","Kann ich da mal vorbei?","May I pass through here?","","","SVM_11_MakeWay","",""
"_work/Data/Scripts/content/Story/svm.d:1667","Geh zur Seite!","Step aside!","","","SVM_11_OutOfMyWay","",""
"_work/Data/Scripts/content/Story/svm.d:1668","Soll ich's in dich reinprügeln? Weg da!","Do you want me to beat it into your brain? Get out of here!","","","SVM_11_YouDeafOrWhat","",""
"_work/Data/Scripts/content/Story/svm.d:1669","Willst du dich noch mal mit mir anlegen?","You looking for trouble with me again?","","","SVM_11_LookingForTroubleAgain","",""
"_work/Data/Scripts/content/Story/svm.d:1670","Man muss sich ja auch nicht überall einmischen ...","I'm not gonna get involved in this!","","","SVM_11_LookAway","",""
"_work/Data/Scripts/content/Story/svm.d:1671","Gut! Es gehört dir.","Good! It's yours.","","","SVM_11_OkayKeepIt","",""
"_work/Data/Scripts/content/Story/svm.d:1672","Was war denn das?","What was that?","","","SVM_11_WhatsThat","",""
"_work/Data/Scripts/content/Story/svm.d:1673","Du trägst meine Waffe ... ?","You're carrying my weapon ... ?","","","SVM_11_ThatsMyWeapon","",""
"_work/Data/Scripts/content/Story/svm.d:1674","Komm, gib schon her!","Come on, give it to me!","","","SVM_11_GiveItToMe","",""
"_work/Data/Scripts/content/Story/svm.d:1675","Behalt's, ich brauch's sowieso nicht.","Keep it, I don't need it anyway.","","","SVM_11_YouCanKeeptheCrap","",""
"_work/Data/Scripts/content/Story/svm.d:1676","Sie haben einen unserer Jungs erwischt. Wenn ich das Schwein kriege ...","They got one of our guys. If I get that swine ...","","","SVM_11_TheyKilledMyFriend","",""
"_work/Data/Scripts/content/Story/svm.d:1677","Was ist denn los?","What's up, anyway?","","","SVM_11_YouDisturbedMySlumber","",""
"_work/Data/Scripts/content/Story/svm.d:1678","Haste was aufs Maul gekriegt? Geschieht dir recht!","Did you get a thrashing? Serves you right!","","","SVM_11_SuckerGotSome","",""
"_work/Data/Scripts/content/Story/svm.d:1679","Du hast einen der Erzbarone besiegt. Das war eindrucksvoll, aber dumm. Sehr dumm.","You defeated one of the Ore Barons. That was impressive, but stupid. Very stupid indeed.","","","SVM_11_SuckerDefeatedEBr","",""
"_work/Data/Scripts/content/Story/svm.d:1680","Du hast einen der Gurus besiegt.","You defeated one of the Gurus.","","","SVM_11_SuckerDefeatedGur","",""
"_work/Data/Scripts/content/Story/svm.d:1681","Einen Magier zu besiegen ... ist nicht besonders clever!","To win against a magician ... is not exactly clever!","","","SVM_11_SuckerDefeatedMage","",""
"_work/Data/Scripts/content/Story/svm.d:1682","Ich beschütze die Jungs hier und du hast einen von ihnen umgehauen ...","I protect the guys here, you have knocked one of them out ...","","","SVM_11_SuckerDefeatedNov_Guard","",""
"_work/Data/Scripts/content/Story/svm.d:1683","Wenn du dich an den Buddlern vergreifst, vergreifst du dich an meiner Kasse!","If you touch the diggers, you're laying hands on my income!","","","SVM_11_SuckerDefeatedVlk_Guard","",""
"_work/Data/Scripts/content/Story/svm.d:1684","Wer meine Kameraden verletzt, verletzt mich.","Whoever hurts my pals is hurting me.","","","SVM_11_YouDefeatedMyComrade","",""
"_work/Data/Scripts/content/Story/svm.d:1685","Vergreif dich noch einmal an unseren Jungs und es wird dir Leid tun.","Lay your hands on a novice again and you'll be sorry!","","","SVM_11_YouDefeatedNOV_Guard","",""
"_work/Data/Scripts/content/Story/svm.d:1686","Meine Schützlinge anzugreifen kann dich den Kopf kosten.","Attacking my protégés can cost you your head.","","","SVM_11_YouDefeatedVLK_Guard","",""
"_work/Data/Scripts/content/Story/svm.d:1687","Du wagst es, mir unter die Augen zu treten, dreckiger Dieb?","You dare to turn up here, dirty thief?","","","SVM_11_YouStoleFromMe","",""
"_work/Data/Scripts/content/Story/svm.d:1688","Du hast einige Sachen, die uns gehören. Gib sie besser wieder her.","You got some stuff that belongs to us. You'd better give it back.","","","SVM_11_YouStoleFromUs","",""
"_work/Data/Scripts/content/Story/svm.d:1689","Mann! Du hast die Erzbarone beklaut! Na, die werden toben!","Man! You've stolen from the Ore Barons! Boy, they'll be raging!","","","SVM_11_YouStoleFromEBr","",""
"_work/Data/Scripts/content/Story/svm.d:1690","Du hast die Gurus um ein paar Sachen erleichtert, was?","You relieved the Gurus of a few things, didn't you?","","","SVM_11_YouStoleFromGur","",""
"_work/Data/Scripts/content/Story/svm.d:1691","Du hast die Magier um ein paar Sachen erleichtert, was?","You relieved the magicians of a couple of things, didn't you?","","","SVM_11_StoleFromMage","",""
"_work/Data/Scripts/content/Story/svm.d:1692","Du hast die Regel Nr.1 gebrochen! Kein Töten!","You have broken rule no. 1! No killing!","","","SVM_11_YouKilledMyFriend","",""
"_work/Data/Scripts/content/Story/svm.d:1693","Du hast einen Erzbaron umgelegt! Mann, du bist wohl komplett durchgedreht!?","You killed an Ore Baron! Man, are you completely nuts!?","","","SVM_11_YouKilledEBr","",""
"_work/Data/Scripts/content/Story/svm.d:1694","Du hast einen Guru getötet! Junge, das kann doch nicht wahr sein!","You killed a Guru! Boy, I don't believe it!","","","SVM_11_YouKilledGur","",""
"_work/Data/Scripts/content/Story/svm.d:1695","Du hast einen Magier umgebracht! Wie sollen wir das denn erklären?","You have killed a magician! How do you ever plan to justify that?","","","SVM_11_YouKilledMage","",""
"_work/Data/Scripts/content/Story/svm.d:1696","Jemand aus dem Alten Lager ist verstorben und dein Name wird dabei erwähnt ...","A member of the Old Camp is dead, and your name is mentioned in connection with his death ...","","","SVM_11_YouKilledOCfolk","",""
"_work/Data/Scripts/content/Story/svm.d:1697","Das Neue Lager hat einen tragischen Verlust erlitten, und scheinbar hast du damit zu tun!","The New Camp has suffered a tragic loss, and it appears you're involved!","","","SVM_11_YouKilledNCfolk","",""
"_work/Data/Scripts/content/Story/svm.d:1698","Die Bruderschaft ist um einen Anhänger ärmer und wie es scheint, warst du das!","The brotherhood counts one believer less, and you got him on your conscience!","","","SVM_11_YouKilledPSIfolk","",""
"_work/Data/Scripts/content/Story/svm.d:1699","Das wieder hinzubiegen wird nicht einfach!","It won't be easy to straighten that out!","","","SVM_11_GetThingsRight","",""
"_work/Data/Scripts/content/Story/svm.d:1700","Das war ein guter Kampf. Die Schmerzen werde ich noch tagelang spüren. Aber jetzt ist gut!","That was a good fight. I'll still feel the pain for days. But now it's over!","","","SVM_11_YouDefeatedMeWell","",""
"_work/Data/Scripts/content/Story/svm.d:1701"," ... wenn du meinst ..."," ... if you think ...","","","SVM_11_Smalltalk01","",""
"_work/Data/Scripts/content/Story/svm.d:1702"," ... kann schon sein ..."," ... maybe ...","","","SVM_11_Smalltalk02","",""
"_work/Data/Scripts/content/Story/svm.d:1703"," ... war nicht besonders schlau ..."," ... that wasn't very clever ...","","","SVM_11_Smalltalk03","",""
"_work/Data/Scripts/content/Story/svm.d:1704"," ... ich halt mich da lieber raus ..."," ... I'd better keep out of it ...","","","SVM_11_Smalltalk04","",""
"_work/Data/Scripts/content/Story/svm.d:1705"," ... das ist wirklich nicht mein Problem ..."," ... that's really not my problem ...","","","SVM_11_Smalltalk05","",""
"_work/Data/Scripts/content/Story/svm.d:1706"," ... war doch klar, dass das Ärger gibt ..."," ... it was obvious that there would be trouble ahead ...","","","SVM_11_Smalltalk06","",""
"_work/Data/Scripts/content/Story/svm.d:1707"," ... aber behalt's für dich, muss nicht gleich jeder wissen ..."," ... but keep it to yourself, people don't need to know it.","","","SVM_11_Smalltalk07","",""
"_work/Data/Scripts/content/Story/svm.d:1708"," ... das passiert mir nicht noch mal ..."," ... that won't happen again ...","","","SVM_11_Smalltalk08","",""
"_work/Data/Scripts/content/Story/svm.d:1709"," ... an der Geschichte muss wohl doch was dran sein ..."," ... there must be something about that story after all because...","","","SVM_11_Smalltalk09","",""
"_work/Data/Scripts/content/Story/svm.d:1710"," ... man muss eben aufpassen, was man rumerzählt ..."," ... you have to watch what you tell people ...","","","SVM_11_Smalltalk10","",""
"_work/Data/Scripts/content/Story/svm.d:1711"," ... solange ich damit nichts zu tun habe ..."," ... as long as I'm not involved …I","","","SVM_11_Smalltalk11","",""
"_work/Data/Scripts/content/Story/svm.d:1712"," ... man darf auch nicht alles glauben, was man hört ..."," ... you shouldn't believe everything you hear ...","","","SVM_11_Smalltalk12","",""
"_work/Data/Scripts/content/Story/svm.d:1713"," ... in seiner Haut will ich trotzdem nicht stecken ..."," ... I wouldn't like to be in his shoes though because he","","","SVM_11_Smalltalk13","",""
"_work/Data/Scripts/content/Story/svm.d:1714"," ... immer wieder dieselbe Leier ..."," ... it's the same story every time …I","","","SVM_11_Smalltalk14","",""
"_work/Data/Scripts/content/Story/svm.d:1715"," ... manche lernen eben gar nichts dazu ..."," ... some people never learn ...","","","SVM_11_Smalltalk15","",""
"_work/Data/Scripts/content/Story/svm.d:1716"," ... früher wäre das ganz anders gelaufen ..."," ... well, there was a time when things would have gone very differently ...","","","SVM_11_Smalltalk16","",""
"_work/Data/Scripts/content/Story/svm.d:1717"," ... gequatscht wird viel ..."," ... people always talk ...","","","SVM_11_Smalltalk17","",""
"_work/Data/Scripts/content/Story/svm.d:1718"," ... ich hör' nicht mehr auf das Gefasel ..."," ... I'm not listening to all the blathering any more ...","","","SVM_11_Smalltalk18","",""
"_work/Data/Scripts/content/Story/svm.d:1719"," ... verlass dich auf jemanden und du bist verlassen, das ist eben so ..."," ... rely on somebody and you're in trouble, that's how it goes ...","","","SVM_11_Smalltalk19","",""
"_work/Data/Scripts/content/Story/svm.d:1720"," ... ich glaube kaum, dass sich daran was ändern wird ..."," ... I doubt that's ever likely to change ...","","","SVM_11_Smalltalk20","",""
"_work/Data/Scripts/content/Story/svm.d:1721"," ... wahrscheinlich hast du Recht ..."," ... you're very probably right ...","","","SVM_11_Smalltalk21","",""
"_work/Data/Scripts/content/Story/svm.d:1722"," ... erst mal abwarten. Es wird nichts so heiß gegessen, wie es gekocht wird ..."," ... hang on. Better not to go rushing into anything ...","","","SVM_11_Smalltalk22","",""
"_work/Data/Scripts/content/Story/svm.d:1723"," ... ich dachte, das wäre schon lange geklärt ..."," ... I thought that had been cleared up ages ago ...","","","SVM_11_Smalltalk23","",""
"_work/Data/Scripts/content/Story/svm.d:1724"," ... lass uns lieber über was anderes reden ..."," ... let's talk about something else instead ...","","","SVM_11_Smalltalk24","",""
"_work/Data/Scripts/content/Story/svm.d:1725","Ommm","Ommm","","","SVM_11_Om","",""
"_work/Data/Scripts/content/Story/svm.d:1731","Pack die Magie weg!","Stop that magic!","","","SVM_12_StopMagic","",""
"_work/Data/Scripts/content/Story/svm.d:1732","Wenn ich 'Magie weg' sage, dann mein' ich das auch so!","When I say 'stop the magic', I mean it!","","","SVM_12_ISaidStopMagic","",""
"_work/Data/Scripts/content/Story/svm.d:1733","Was hast du mit der Waffe vor, Mann!","What do you intend to do with the weapon, man!","","","SVM_12_WeaponDown","",""
"_work/Data/Scripts/content/Story/svm.d:1734","Steck weg, das Ding!","Put that thing down!","","","SVM_12_ISaidWeaponDown","",""
"_work/Data/Scripts/content/Story/svm.d:1735","Du zielst auf mich!","You're aiming at me!","","","SVM_12_WatchYourAim","",""
"_work/Data/Scripts/content/Story/svm.d:1736","Wenn du nicht aufhörst, gibt's Ärger!","If you don't stop doing that you'll be in trouble!","","","SVM_12_WatchYourAimAngry","",""
"_work/Data/Scripts/content/Story/svm.d:1737","Hey, bist du blind oder was?","Hey, are you blind or what?","","","SVM_12_WhatAreYouDoing","",""
"_work/Data/Scripts/content/Story/svm.d:1738","Den kleinen Streit vergessen wir, okay?","Let's forget about that little argument, okay?","","","SVM_12_LetsForgetOurLittleFight","",""
"_work/Data/Scripts/content/Story/svm.d:1739","Eben war er doch noch da!? Seltsam! ","But he was here just a moment ago!? Strange!","","","SVM_12_Strange","",""
"_work/Data/Scripts/content/Story/svm.d:1740","Du bist fällig, Mistvieh!!","Your time has come, bastard!!","","","SVM_12_DieMonster","",""
"_work/Data/Scripts/content/Story/svm.d:1741","Jetzt wird abgerechnet!","It's payday!","","","SVM_12_DieMortalEnemy","",""
"_work/Data/Scripts/content/Story/svm.d:1742","Du brauchst wohl dringend was hinter die Ohren!","You're asking for a real beating!","","","SVM_12_NowWait","",""
"_work/Data/Scripts/content/Story/svm.d:1743","Hast du immer noch nicht genug?","You still haven't had enough?","","","SVM_12_YouStillNotHaveEnough","",""
"_work/Data/Scripts/content/Story/svm.d:1744","Na gut, du willst es scheinbar so!","Okay, you asked for it!","","","SVM_12_YouAskedForIt","",""
"_work/Data/Scripts/content/Story/svm.d:1745","Hier werden sie dich raustragen müssen!","They'll have to carry you out!","","","SVM_12_NowWaitIntruder","",""
"_work/Data/Scripts/content/Story/svm.d:1746","Ich hab' dich gewarnt. Wer an meine Sachen geht, kriegt Ärger!","I warned you. If you touch my stuff, you're in trouble!","","","SVM_12_IWillTeachYouRespectForForeignProperty","",""
"_work/Data/Scripts/content/Story/svm.d:1747","Du Dieb! Ich bring' dir Manieren bei!","You thief! I'll teach you manners!","","","SVM_12_DirtyThief","",""
"_work/Data/Scripts/content/Story/svm.d:1748","Niemand vergreift sich ungestraft an meinen Jungs!","Nobody messes with my guys without feeling very sorry after!","","","SVM_12_YouAttackedMyCharge","",""
"_work/Data/Scripts/content/Story/svm.d:1749","Du hast einen meiner Jungs platt gemacht. Jetzt mach' ich DICH platt!","You've killed one of my men. Now I will kill YOU!","","","SVM_12_YouKilledOneOfUs","",""
"_work/Data/Scripts/content/Story/svm.d:1750","Aaargl","Aaargl","","","SVM_12_Dead","",""
"_work/Data/Scripts/content/Story/svm.d:1751","Aargh","Aargh","","","SVM_12_Aargh_1","",""
"_work/Data/Scripts/content/Story/svm.d:1752","Aargh","Aargh","","","SVM_12_Aargh_2","",""
"_work/Data/Scripts/content/Story/svm.d:1753","Aargh","Aargh","","","SVM_12_Aargh_3","",""
"_work/Data/Scripts/content/Story/svm.d:1754","UUAAARRGGGHHH!!!","UUAAARRGGGHHH!!!","","","SVM_12_Berzerk","",""
"_work/Data/Scripts/content/Story/svm.d:1755","Das wird dir noch Leid tun!","You'll be sorry for that!","","","SVM_12_YoullBeSorryForThis","",""
"_work/Data/Scripts/content/Story/svm.d:1756","Bleib locker! Hast gewonnen.","Keep cool! You've won.","","","SVM_12_YesYes","",""
"_work/Data/Scripts/content/Story/svm.d:1757","Das ist 'ne Nummer zu groß! Ich hau ab!","That one's too big for me, I'm off!","","","SVM_12_ShitWhatAMonster","",""
"_work/Data/Scripts/content/Story/svm.d:1758","Verdammt!","Damn!","","","SVM_12_Help","",""
"_work/Data/Scripts/content/Story/svm.d:1759","Beim nächsten Mal sieht die Sache anders aus!","Next time things'll look different!","","","SVM_12_WeWillMeetAgain","",""
"_work/Data/Scripts/content/Story/svm.d:1760","Versuch das nicht noch mal!","Don't try that again!","","","SVM_12_NeverTryThatAgain","",""
"_work/Data/Scripts/content/Story/svm.d:1761","Die Waffe gefällt mir!","I like that weapon!","","","SVM_12_ITakeYourWeapon","",""
"_work/Data/Scripts/content/Story/svm.d:1762","Ich sorg dafür, dass dein Erz gut angelegt wird!","I'll make sure your ore is well invested!","","","SVM_12_ITookYourOre","",""
"_work/Data/Scripts/content/Story/svm.d:1763","Mist! Kein Erz!","Damn! No ore!","","","SVM_12_ShitNoOre","",""
"_work/Data/Scripts/content/Story/svm.d:1764","Finger weg!","Hands off!","","","SVM_12_HandsOff","",""
"_work/Data/Scripts/content/Story/svm.d:1765","Raus hier!","Get out of here!","","","SVM_12_GetOutOfHere","",""
